"No.","Time","Source","Destination","Protocol","Length","Info"
"1","0.000000000","10.0.0.1","10.0.0.2","TCP","74","37598  >  34567 [SYN] Seq=0 Win=29200 Len=0 MSS=1460 SACK_PERM=1 TSval=657509 TSecr=0 WS=512"
"2","0.153498040","10.0.0.2","10.0.0.1","TCP","74","34567  >  37598 [SYN, ACK] Seq=0 Ack=1 Win=28960 Len=0 MSS=1460 SACK_PERM=1 TSval=657535 TSecr=657509 WS=512"
"3","0.205178402","10.0.0.1","10.0.0.2","TCP","66","37598  >  34567 [ACK] Seq=1 Ack=1 Win=29696 Len=0 TSval=657560 TSecr=657535"
"4","0.223457275","10.0.0.1","10.0.0.2","TCP","2114","37598  >  34567 [PSH, ACK] Seq=1 Ack=1 Win=29696 Len=2048 TSval=657561 TSecr=657535"
"5","0.235918863","10.0.0.1","10.0.0.2","TCP","1514","37598  >  34567 [ACK] Seq=2049 Ack=1 Win=29696 Len=1448 TSval=657561 TSecr=657535"
"6","0.248189859","10.0.0.1","10.0.0.2","TCP","1514","37598  >  34567 [ACK] Seq=3497 Ack=1 Win=29696 Len=1448 TSval=657561 TSecr=657535"
"7","0.271867690","10.0.0.1","10.0.0.2","TCP","2962","37598  >  34567 [ACK] Seq=4945 Ack=1 Win=29696 Len=2896 TSval=657561 TSecr=657535"
"8","0.296151167","10.0.0.1","10.0.0.2","TCP","2962","[TCP Previous segment not captured] 37598  >  34567 [ACK] Seq=9289 Ack=1 Win=29696 Len=2896 TSval=657561 TSecr=657535"
"9","0.307969838","10.0.0.1","10.0.0.2","TCP","1514","37598  >  34567 [ACK] Seq=12185 Ack=1 Win=29696 Len=1448 TSval=657561 TSecr=657535"
"10","0.376283763","10.0.0.2","10.0.0.1","TCP","66","34567  >  37598 [ACK] Seq=1 Ack=1449 Win=32256 Len=0 TSval=657591 TSecr=657561"
"11","0.376286027","10.0.0.2","10.0.0.1","TCP","66","34567  >  37598 [ACK] Seq=1 Ack=2049 Win=34816 Len=0 TSval=657591 TSecr=657561"
"12","0.387802971","10.0.0.2","10.0.0.1","TCP","66","34567  >  37598 [ACK] Seq=1 Ack=3497 Win=37888 Len=0 TSval=657594 TSecr=657561"
"13","0.399920075","10.0.0.2","10.0.0.1","TCP","66","34567  >  37598 [ACK] Seq=1 Ack=4945 Win=40960 Len=0 TSval=657597 TSecr=657561"
"14","0.423075859","10.0.0.2","10.0.0.1","TCP","66","34567  >  37598 [ACK] Seq=1 Ack=7841 Win=46592 Len=0 TSval=657603 TSecr=657561"
"15","0.447934518","10.0.0.2","10.0.0.1","TCP","78","[TCP Window Update] 34567  >  37598 [ACK] Seq=1 Ack=7841 Win=52224 Len=0 TSval=657609 TSecr=657561 SLE=9289 SRE=12185"
"16","0.451111845","10.0.0.1","10.0.0.2","TCP","2962","37598  >  34567 [ACK] Seq=13633 Ack=1 Win=29696 Len=2896 TSval=657616 TSecr=657591"
"17","0.462519751","10.0.0.2","10.0.0.1","TCP","78","[TCP Window Update] 34567  >  37598 [ACK] Seq=1 Ack=7841 Win=55296 Len=0 TSval=657612 TSecr=657561 SLE=9289 SRE=13633"
"18","0.475663592","10.0.0.1","10.0.0.2","TCP","2962","37598  >  34567 [ACK] Seq=16529 Ack=1 Win=29696 Len=2896 TSval=657616 TSecr=657591"
"19","0.499290169","10.0.0.1","10.0.0.2","TCP","2962","37598  >  34567 [ACK] Seq=19425 Ack=1 Win=29696 Len=2896 TSval=657619 TSecr=657594"
"20","0.523656158","10.0.0.1","10.0.0.2","TCP","2962","37598  >  34567 [ACK] Seq=22321 Ack=1 Win=29696 Len=2896 TSval=657622 TSecr=657597"
"21","0.547786754","10.0.0.1","10.0.0.2","TCP","2962","37598  >  34567 [ACK] Seq=25217 Ack=1 Win=29696 Len=2896 TSval=657628 TSecr=657603"
"22","0.572350563","10.0.0.1","10.0.0.2","TCP","2962","37598  >  34567 [ACK] Seq=28113 Ack=1 Win=29696 Len=2896 TSval=657628 TSecr=657603"
"23","0.596816631","10.0.0.1","10.0.0.2","TCP","2962","37598  >  34567 [ACK] Seq=31009 Ack=1 Win=29696 Len=2896 TSval=657634 TSecr=657609"
"24","0.602929827","10.0.0.2","10.0.0.1","TCP","78","[TCP Window Update] 34567  >  37598 [ACK] Seq=1 Ack=7841 Win=60928 Len=0 TSval=657648 TSecr=657561 SLE=9289 SRE=16529"
"25","0.608510721","10.0.0.1","10.0.0.2","TCP","1514","[TCP Out-Of-Order] 37598  >  34567 [ACK] Seq=7841 Ack=1 Win=29696 Len=1448 TSval=657638 TSecr=657612"
"26","0.628352589","10.0.0.2","10.0.0.1","TCP","78","[TCP Window Update] 34567  >  37598 [ACK] Seq=1 Ack=7841 Win=67072 Len=0 TSval=657654 TSecr=657561 SLE=9289 SRE=19425"
"27","0.653730018","10.0.0.2","10.0.0.1","TCP","78","[TCP Window Update] 34567  >  37598 [ACK] Seq=1 Ack=7841 Win=72704 Len=0 TSval=657660 TSecr=657561 SLE=9289 SRE=22321"
"28","0.675485050","10.0.0.2","10.0.0.1","TCP","78","[TCP Window Update] 34567  >  37598 [ACK] Seq=1 Ack=7841 Win=78336 Len=0 TSval=657666 TSecr=657561 SLE=9289 SRE=25217"
"29","0.678781333","10.0.0.1","10.0.0.2","TCP","2962","37598  >  34567 [ACK] Seq=33905 Ack=1 Win=29696 Len=2896 TSval=657673 TSecr=657648"
"30","0.690829356","10.0.0.1","10.0.0.2","TCP","1514","37598  >  34567 [ACK] Seq=36801 Ack=1 Win=29696 Len=1448 TSval=657679 TSecr=657654"
"31","0.698828651","10.0.0.2","10.0.0.1","TCP","78","[TCP Window Update] 34567  >  37598 [ACK] Seq=1 Ack=7841 Win=84480 Len=0 TSval=657672 TSecr=657561 SLE=9289 SRE=28113"
"32","0.716290064","10.0.0.1","10.0.0.2","TCP","1514","37598  >  34567 [ACK] Seq=38249 Ack=1 Win=29696 Len=1448 TSval=657686 TSecr=657660"
"33","0.729632246","10.0.0.2","10.0.0.1","TCP","78","[TCP Window Update] 34567  >  37598 [ACK] Seq=1 Ack=7841 Win=90112 Len=0 TSval=657678 TSecr=657561 SLE=9289 SRE=31009"
"34","0.749900228","10.0.0.2","10.0.0.1","TCP","78","[TCP Window Update] 34567  >  37598 [ACK] Seq=1 Ack=7841 Win=95744 Len=0 TSval=657684 TSecr=657561 SLE=9289 SRE=33905"
"35","0.762137360","10.0.0.2","10.0.0.1","TCP","66","34567  >  37598 [ACK] Seq=1 Ack=33905 Win=98816 Len=0 TSval=657687 TSecr=657638"
"36","0.773531510","10.0.0.1","10.0.0.2","TCP","2962","37598  >  34567 [ACK] Seq=39697 Ack=1 Win=29696 Len=2896 TSval=657697 TSecr=657672"
"37","0.804087410","10.0.0.1","10.0.0.2","TCP","2962","37598  >  34567 [ACK] Seq=42593 Ack=1 Win=29696 Len=2896 TSval=657705 TSecr=657678"
"38","0.828645142","10.0.0.1","10.0.0.2","TCP","2962","37598  >  34567 [ACK] Seq=45489 Ack=1 Win=29696 Len=2896 TSval=657710 TSecr=657684"
"39","0.830628791","10.0.0.2","10.0.0.1","TCP","66","34567  >  37598 [ACK] Seq=1 Ack=36801 Win=104448 Len=0 TSval=657705 TSecr=657673"
"40","0.842662323","10.0.0.2","10.0.0.1","TCP","66","34567  >  37598 [ACK] Seq=1 Ack=38249 Win=107520 Len=0 TSval=657708 TSecr=657679"
"41","0.852928213","10.0.0.1","10.0.0.2","TCP","2962","37598  >  34567 [ACK] Seq=48385 Ack=1 Win=29696 Len=2896 TSval=657713 TSecr=657687"
"42","0.867379893","10.0.0.2","10.0.0.1","TCP","66","34567  >  37598 [ACK] Seq=1 Ack=39697 Win=110080 Len=0 TSval=657714 TSecr=657686"
"43","0.877289903","10.0.0.1","10.0.0.2","TCP","2962","37598  >  34567 [ACK] Seq=51281 Ack=1 Win=29696 Len=2896 TSval=657713 TSecr=657687"
"44","0.905306929","10.0.0.1","10.0.0.2","TCP","1514","[TCP Previous segment not captured] 37598  >  34567 [ACK] Seq=57073 Ack=1 Win=29696 Len=1448 TSval=657733 TSecr=657708"
"45","0.924801787","10.0.0.2","10.0.0.1","TCP","66","34567  >  37598 [ACK] Seq=1 Ack=42593 Win=116224 Len=0 TSval=657728 TSecr=657697"
"46","0.930090396","10.0.0.1","10.0.0.2","TCP","1514","37598  >  34567 [ACK] Seq=58521 Ack=1 Win=29696 Len=1448 TSval=657739 TSecr=657714"
"47","0.955653242","10.0.0.2","10.0.0.1","TCP","66","34567  >  37598 [ACK] Seq=1 Ack=45489 Win=121856 Len=0 TSval=657736 TSecr=657705"
"48","0.980487871","10.0.0.2","10.0.0.1","TCP","66","34567  >  37598 [ACK] Seq=1 Ack=48385 Win=127488 Len=0 TSval=657742 TSecr=657710"
"49","0.999642858","10.0.0.1","10.0.0.2","TCP","2962","37598  >  34567 [ACK] Seq=59969 Ack=1 Win=29696 Len=2896 TSval=657753 TSecr=657728"
"50","1.004764215","10.0.0.2","10.0.0.1","TCP","66","34567  >  37598 [ACK] Seq=1 Ack=51281 Win=133632 Len=0 TSval=657748 TSecr=657713"
"51","1.028458607","10.0.0.2","10.0.0.1","TCP","66","34567  >  37598 [ACK] Seq=1 Ack=54177 Win=139264 Len=0 TSval=657754 TSecr=657713"
"52","1.030324477","10.0.0.1","10.0.0.2","TCP","2962","37598  >  34567 [ACK] Seq=62865 Ack=1 Win=29696 Len=2896 TSval=657761 TSecr=657736"
"53","1.056140330","10.0.0.1","10.0.0.2","TCP","2962","37598  >  34567 [ACK] Seq=65761 Ack=1 Win=29696 Len=2896 TSval=657767 TSecr=657742"
"54","1.056163013","10.0.0.2","10.0.0.1","TCP","78","[TCP Window Update] 34567  >  37598 [ACK] Seq=1 Ack=54177 Win=142336 Len=0 TSval=657761 TSecr=657713 SLE=57073 SRE=58521"
"55","1.079510275","10.0.0.1","10.0.0.2","TCP","2962","37598  >  34567 [ACK] Seq=68657 Ack=1 Win=29696 Len=2896 TSval=657773 TSecr=657748"
"56","1.080955061","10.0.0.2","10.0.0.1","TCP","78","[TCP Window Update] 34567  >  37598 [ACK] Seq=1 Ack=54177 Win=144896 Len=0 TSval=657767 TSecr=657713 SLE=57073 SRE=59969"
"57","1.104064471","10.0.0.1","10.0.0.2","TCP","2962","37598  >  34567 [ACK] Seq=71553 Ack=1 Win=29696 Len=2896 TSval=657779 TSecr=657754"
"58","1.143394613","10.0.0.1","10.0.0.2","TCP","1514","[TCP Out-Of-Order] 37598  >  34567 [ACK] Seq=54177 Ack=1 Win=29696 Len=1448 TSval=657792 TSecr=657767"
"59","1.150869226","10.0.0.2","10.0.0.1","TCP","78","[TCP Window Update] 34567  >  37598 [ACK] Seq=1 Ack=54177 Win=151040 Len=0 TSval=657785 TSecr=657713 SLE=57073 SRE=62865"
"60","1.181415858","10.0.0.2","10.0.0.1","TCP","78","[TCP Window Update] 34567  >  37598 [ACK] Seq=1 Ack=54177 Win=156672 Len=0 TSval=657792 TSecr=657713 SLE=57073 SRE=65761"
"61","1.208747291","10.0.0.2","10.0.0.1","TCP","78","[TCP Window Update] 34567  >  37598 [ACK] Seq=1 Ack=54177 Win=162304 Len=0 TSval=657799 TSecr=657713 SLE=57073 SRE=68657"
"62","1.214140769","10.0.0.1","10.0.0.2","TCP","1514","[TCP Out-Of-Order] 37598  >  34567 [ACK] Seq=55625 Ack=1 Win=29696 Len=1448 TSval=657810 TSecr=657785"
"63","1.232323899","10.0.0.2","10.0.0.1","TCP","78","[TCP Dup ACK 51#1] 34567  >  37598 [ACK] Seq=1 Ack=54177 Win=162304 Len=0 TSval=657805 TSecr=657713 SLE=57073 SRE=71553"
"64","1.255928140","10.0.0.2","10.0.0.1","TCP","78","[TCP Dup ACK 51#2] 34567  >  37598 [ACK] Seq=1 Ack=54177 Win=162304 Len=0 TSval=657811 TSecr=657713 SLE=57073 SRE=74449"
"65","1.284867963","10.0.0.1","10.0.0.2","TCP","2962","[TCP Previous segment not captured] 37598  >  34567 [ACK] Seq=75897 Ack=1 Win=29696 Len=2896 TSval=657824 TSecr=657799"
"66","1.294828846","10.0.0.2","10.0.0.1","TCP","78","34567  >  37598 [ACK] Seq=1 Ack=55625 Win=161280 Len=0 TSval=657820 TSecr=657792 SLE=57073 SRE=74449"
"67","1.307820491","10.0.0.1","10.0.0.2","TCP","2962","37598  >  34567 [ACK] Seq=78793 Ack=1 Win=29696 Len=2896 TSval=657830 TSecr=657805"
"68","1.332196805","10.0.0.1","10.0.0.2","TCP","2962","37598  >  34567 [ACK] Seq=81689 Ack=1 Win=29696 Len=2896 TSval=657836 TSecr=657811"
"69","1.357612859","10.0.0.1","10.0.0.2","TCP","1514","[TCP Out-Of-Order] 37598  >  34567 [ACK] Seq=74449 Ack=1 Win=29696 Len=1448 TSval=657846 TSecr=657820"
"70","1.366843246","10.0.0.2","10.0.0.1","TCP","66","34567  >  37598 [ACK] Seq=1 Ack=74449 Win=161280 Len=0 TSval=657838 TSecr=657810"
"71","1.369293612","10.0.0.1","10.0.0.2","TCP","1514","37598  >  34567 [ACK] Seq=84585 Ack=1 Win=29696 Len=1448 TSval=657846 TSecr=657820"
"72","1.429315175","10.0.0.1","10.0.0.2","TCP","1514","37598  >  34567 [ACK] Seq=86033 Ack=1 Win=29696 Len=1448 TSval=657864 TSecr=657838"
"73","1.437517070","10.0.0.2","10.0.0.1","TCP","78","[TCP Window Update] 34567  >  37598 [ACK] Seq=1 Ack=74449 Win=170496 Len=0 TSval=657856 TSecr=657810 SLE=75897 SRE=78793"
"74","1.458850716","10.0.0.2","10.0.0.1","TCP","78","[TCP Dup ACK 70#1] 34567  >  37598 [ACK] Seq=1 Ack=74449 Win=170496 Len=0 TSval=657862 TSecr=657810 SLE=75897 SRE=81689"
"75","1.483523307","10.0.0.2","10.0.0.1","TCP","78","[TCP Dup ACK 70#2] 34567  >  37598 [ACK] Seq=1 Ack=74449 Win=170496 Len=0 TSval=657868 TSecr=657810 SLE=75897 SRE=84585"
"76","1.508969748","10.0.0.2","10.0.0.1","TCP","66","34567  >  37598 [ACK] Seq=1 Ack=84585 Win=165376 Len=0 TSval=657874 TSecr=657846"
"77","1.512900798","10.0.0.1","10.0.0.2","TCP","2962","37598  >  34567 [ACK] Seq=87481 Ack=1 Win=29696 Len=2896 TSval=657881 TSecr=657856"
"78","1.520649627","10.0.0.2","10.0.0.1","TCP","66","34567  >  37598 [ACK] Seq=1 Ack=86033 Win=170496 Len=0 TSval=657877 TSecr=657846"
"79","1.536263730","10.0.0.1","10.0.0.2","TCP","2962","37598  >  34567 [ACK] Seq=90377 Ack=1 Win=29696 Len=2896 TSval=657887 TSecr=657862"
"80","1.560987598","10.0.0.1","10.0.0.2","TCP","2962","37598  >  34567 [ACK] Seq=93273 Ack=1 Win=29696 Len=2896 TSval=657893 TSecr=657868"
"81","1.572609286","10.0.0.1","10.0.0.2","TCP","1514","37598  >  34567 [ACK] Seq=96169 Ack=1 Win=29696 Len=1448 TSval=657900 TSecr=657874"
"82","1.581922002","10.0.0.2","10.0.0.1","TCP","66","34567  >  37598 [ACK] Seq=1 Ack=87481 Win=170496 Len=0 TSval=657892 TSecr=657864"
"83","1.584662910","10.0.0.1","10.0.0.2","TCP","1514","37598  >  34567 [ACK] Seq=97617 Ack=1 Win=29696 Len=1448 TSval=657902 TSecr=657877"
"84","1.660797836","10.0.0.1","10.0.0.2","TCP","2962","37598  >  34567 [ACK] Seq=99065 Ack=1 Win=29696 Len=2896 TSval=657918 TSecr=657892"
"85","1.665063771","10.0.0.2","10.0.0.1","TCP","66","34567  >  37598 [ACK] Seq=1 Ack=90377 Win=170496 Len=0 TSval=657913 TSecr=657881"
"86","1.687595488","10.0.0.2","10.0.0.1","TCP","66","34567  >  37598 [ACK] Seq=1 Ack=93273 Win=170496 Len=0 TSval=657919 TSecr=657887"
"87","1.713101758","10.0.0.2","10.0.0.1","TCP","66","34567  >  37598 [ACK] Seq=1 Ack=96169 Win=170496 Len=0 TSval=657925 TSecr=657893"
"88","1.738525257","10.0.0.2","10.0.0.1","TCP","66","34567  >  37598 [ACK] Seq=1 Ack=99065 Win=170496 Len=0 TSval=657931 TSecr=657900"
"89","1.740386453","10.0.0.1","10.0.0.2","TCP","2962","37598  >  34567 [ACK] Seq=101961 Ack=1 Win=29696 Len=2896 TSval=657938 TSecr=657913"
"90","1.768967801","10.0.0.1","10.0.0.2","TCP","2962","37598  >  34567 [ACK] Seq=104857 Ack=1 Win=29696 Len=2896 TSval=657944 TSecr=657919"
"91","1.788078543","10.0.0.1","10.0.0.2","TCP","2962","37598  >  34567 [ACK] Seq=107753 Ack=1 Win=29696 Len=2896 TSval=657950 TSecr=657925"
"92","1.813196119","10.0.0.1","10.0.0.2","TCP","2962","37598  >  34567 [ACK] Seq=110649 Ack=1 Win=29696 Len=2896 TSval=657957 TSecr=657931"
"93","1.820029138","10.0.0.2","10.0.0.1","TCP","66","34567  >  37598 [ACK] Seq=1 Ack=101961 Win=170496 Len=0 TSval=657950 TSecr=657918"
"94","1.893962319","10.0.0.2","10.0.0.1","TCP","66","34567  >  37598 [ACK] Seq=1 Ack=104857 Win=170496 Len=0 TSval=657970 TSecr=657938"
"95","1.895585684","10.0.0.1","10.0.0.2","TCP","2962","37598  >  34567 [ACK] Seq=113545 Ack=1 Win=29696 Len=2896 TSval=657977 TSecr=657950"
"96","1.921159912","10.0.0.2","10.0.0.1","TCP","66","34567  >  37598 [ACK] Seq=1 Ack=107753 Win=170496 Len=0 TSval=657977 TSecr=657944"
"97","1.944583355","10.0.0.2","10.0.0.1","TCP","66","34567  >  37598 [ACK] Seq=1 Ack=110649 Win=170496 Len=0 TSval=657982 TSecr=657950"
"98","1.964190942","10.0.0.2","10.0.0.1","TCP","66","34567  >  37598 [ACK] Seq=1 Ack=113545 Win=170496 Len=0 TSval=657988 TSecr=657957"
"99","1.968775724","10.0.0.1","10.0.0.2","TCP","2962","37598  >  34567 [ACK] Seq=116441 Ack=1 Win=29696 Len=2896 TSval=657996 TSecr=657970"
"100","1.996595100","10.0.0.1","10.0.0.2","TCP","2962","37598  >  34567 [ACK] Seq=119337 Ack=1 Win=29696 Len=2896 TSval=658003 TSecr=657977"
"101","2.021197140","10.0.0.1","10.0.0.2","TCP","2962","37598  >  34567 [ACK] Seq=122233 Ack=1 Win=29696 Len=2896 TSval=658008 TSecr=657982"
"102","2.044935216","10.0.0.1","10.0.0.2","TCP","2962","37598  >  34567 [ACK] Seq=125129 Ack=1 Win=29696 Len=2896 TSval=658013 TSecr=657988"
"103","2.047172677","10.0.0.2","10.0.0.1","TCP","66","34567  >  37598 [ACK] Seq=1 Ack=116441 Win=170496 Len=0 TSval=658009 TSecr=657977"
"104","2.120192108","10.0.0.2","10.0.0.1","TCP","66","34567  >  37598 [ACK] Seq=1 Ack=119337 Win=170496 Len=0 TSval=658027 TSecr=657996"
"105","2.123045320","10.0.0.1","10.0.0.2","TCP","2962","37598  >  34567 [ACK] Seq=128025 Ack=1 Win=29696 Len=2896 TSval=658034 TSecr=658009"
"106","2.149256344","10.0.0.2","10.0.0.1","TCP","66","34567  >  37598 [ACK] Seq=1 Ack=122233 Win=170496 Len=0 TSval=658034 TSecr=658003"
"107","2.173423929","10.0.0.2","10.0.0.1","TCP","66","34567  >  37598 [ACK] Seq=1 Ack=125129 Win=170496 Len=0 TSval=658040 TSecr=658008"
"108","2.194785388","10.0.0.1","10.0.0.2","TCP","2962","37598  >  34567 [ACK] Seq=130921 Ack=1 Win=29696 Len=2896 TSval=658052 TSecr=658027"
"109","2.196550888","10.0.0.2","10.0.0.1","TCP","66","34567  >  37598 [ACK] Seq=1 Ack=128025 Win=170496 Len=0 TSval=658046 TSecr=658013"
"110","2.224410335","10.0.0.1","10.0.0.2","TCP","2962","37598  >  34567 [ACK] Seq=133817 Ack=1 Win=29696 Len=2896 TSval=658059 TSecr=658034"
"111","2.271346704","10.0.0.1","10.0.0.2","TCP","2962","[TCP Previous segment not captured] 37598  >  34567 [ACK] Seq=139609 Ack=1 Win=29696 Len=2896 TSval=658071 TSecr=658046"
"112","2.275807370","10.0.0.2","10.0.0.1","TCP","66","34567  >  37598 [ACK] Seq=1 Ack=130921 Win=170496 Len=0 TSval=658065 TSecr=658034"
"113","2.347290646","10.0.0.2","10.0.0.1","TCP","66","34567  >  37598 [ACK] Seq=1 Ack=133817 Win=170496 Len=0 TSval=658084 TSecr=658052"
"114","2.350554227","10.0.0.1","10.0.0.2","TCP","2962","37598  >  34567 [ACK] Seq=142505 Ack=1 Win=29696 Len=2896 TSval=658091 TSecr=658065"
"115","2.382618348","10.0.0.2","10.0.0.1","TCP","66","34567  >  37598 [ACK] Seq=1 Ack=136713 Win=170496 Len=0 TSval=658091 TSecr=658059"
"116","2.422101496","10.0.0.1","10.0.0.2","TCP","2962","37598  >  34567 [ACK] Seq=145401 Ack=1 Win=29696 Len=2896 TSval=658109 TSecr=658084"
"117","2.423934779","10.0.0.2","10.0.0.1","TCP","78","[TCP Dup ACK 115#1] 34567  >  37598 [ACK] Seq=1 Ack=136713 Win=170496 Len=0 TSval=658103 TSecr=658059 SLE=139609 SRE=142505"
"118","2.457565181","10.0.0.1","10.0.0.2","TCP","2962","37598  >  34567 [ACK] Seq=148297 Ack=1 Win=29696 Len=2896 TSval=658118 TSecr=658091"
"119","2.470051562","10.0.0.1","10.0.0.2","TCP","1514","37598  >  34567 [ACK] Seq=151193 Ack=1 Win=29696 Len=1448 TSval=658118 TSecr=658091"
"120","2.486487436","10.0.0.1","10.0.0.2","TCP","1514","[TCP Out-Of-Order] 37598  >  34567 [ACK] Seq=136713 Ack=1 Win=29696 Len=1448 TSval=658128 TSecr=658103"
"121","2.498678942","10.0.0.1","10.0.0.2","TCP","1514","37598  >  34567 [ACK] Seq=152641 Ack=1 Win=29696 Len=1448 TSval=658128 TSecr=658103"
"122","2.502316169","10.0.0.2","10.0.0.1","TCP","78","[TCP Dup ACK 115#2] 34567  >  37598 [ACK] Seq=1 Ack=136713 Win=170496 Len=0 TSval=658123 TSecr=658059 SLE=139609 SRE=145401"
"123","2.574504860","10.0.0.2","10.0.0.1","TCP","78","[TCP Dup ACK 115#3] 34567  >  37598 [ACK] Seq=1 Ack=136713 Win=170496 Len=0 TSval=658140 TSecr=658059 SLE=139609 SRE=148297"
"124","2.609812448","10.0.0.2","10.0.0.1","TCP","78","[TCP Dup ACK 115#4] 34567  >  37598 [ACK] Seq=1 Ack=136713 Win=170496 Len=0 TSval=658149 TSecr=658059 SLE=139609 SRE=151193"
"125","2.621076912","10.0.0.2","10.0.0.1","TCP","78","[TCP Dup ACK 115#5] 34567  >  37598 [ACK] Seq=1 Ack=136713 Win=170496 Len=0 TSval=658152 TSecr=658059 SLE=139609 SRE=152641"
"126","2.637276199","10.0.0.1","10.0.0.2","TCP","1514","[TCP Out-Of-Order] 37598  >  34567 [ACK] Seq=138161 Ack=1 Win=29696 Len=1448 TSval=658166 TSecr=658140"
"127","2.638171229","10.0.0.2","10.0.0.1","TCP","78","34567  >  37598 [ACK] Seq=1 Ack=138161 Win=169472 Len=0 TSval=658156 TSecr=658128 SLE=139609 SRE=152641"
"128","2.649310730","10.0.0.1","10.0.0.2","TCP","1514","37598  >  34567 [ACK] Seq=154089 Ack=1 Win=29696 Len=1448 TSval=658166 TSecr=658140"
"129","2.649800310","10.0.0.2","10.0.0.1","TCP","78","[TCP Dup ACK 127#1] 34567  >  37598 [ACK] Seq=1 Ack=138161 Win=169472 Len=0 TSval=658159 TSecr=658128 SLE=139609 SRE=154089"
"130","2.685206225","10.0.0.1","10.0.0.2","TCP","2962","37598  >  34567 [ACK] Seq=155537 Ack=1 Win=29696 Len=2896 TSval=658175 TSecr=658149"
"131","2.697174967","10.0.0.1","10.0.0.2","TCP","1514","37598  >  34567 [ACK] Seq=158433 Ack=1 Win=29696 Len=1448 TSval=658177 TSecr=658152"
"132","2.708729968","10.0.0.1","10.0.0.2","TCP","1514","37598  >  34567 [ACK] Seq=159881 Ack=1 Win=29696 Len=1448 TSval=658182 TSecr=658156"
"133","2.720766895","10.0.0.1","10.0.0.2","TCP","1514","37598  >  34567 [ACK] Seq=161329 Ack=1 Win=29696 Len=1448 TSval=658185 TSecr=658159"
"134","2.791038299","10.0.0.2","10.0.0.1","TCP","66","34567  >  37598 [ACK] Seq=1 Ack=154089 Win=164352 Len=0 TSval=658194 TSecr=658166"
"135","2.842022470","10.0.0.2","10.0.0.1","TCP","66","34567  >  37598 [ACK] Seq=1 Ack=158433 Win=170496 Len=0 TSval=658207 TSecr=658166"
"136","2.865828363","10.0.0.1","10.0.0.2","TCP","2962","37598  >  34567 [ACK] Seq=162777 Ack=1 Win=29696 Len=2896 TSval=658220 TSecr=658194"
"137","2.865838232","10.0.0.2","10.0.0.1","TCP","66","34567  >  37598 [ACK] Seq=1 Ack=161329 Win=170496 Len=0 TSval=658213 TSecr=658177"
"138","2.914998507","10.0.0.2","10.0.0.1","TCP","66","34567  >  37598 [ACK] Seq=1 Ack=162777 Win=170496 Len=0 TSval=658226 TSecr=658185"
"139","2.917093634","10.0.0.1","10.0.0.2","TCP","2962","[TCP Previous segment not captured] 37598  >  34567 [ACK] Seq=168569 Ack=1 Win=29696 Len=2896 TSval=658233 TSecr=658207"
"140","2.989763029","10.0.0.1","10.0.0.2","TCP","2962","[TCP Previous segment not captured] 37598  >  34567 [ACK] Seq=174361 Ack=1 Win=29696 Len=2896 TSval=658251 TSecr=658226"
"141","3.018195510","10.0.0.2","10.0.0.1","TCP","66","34567  >  37598 [ACK] Seq=1 Ack=165673 Win=170496 Len=0 TSval=658251 TSecr=658220"
"142","3.069174264","10.0.0.2","10.0.0.1","TCP","78","[TCP Dup ACK 141#1] 34567  >  37598 [ACK] Seq=1 Ack=165673 Win=170496 Len=0 TSval=658264 TSecr=658220 SLE=168569 SRE=171465"
"143","3.093587026","10.0.0.1","10.0.0.2","TCP","2962","37598  >  34567 [ACK] Seq=177257 Ack=1 Win=29696 Len=2896 TSval=658277 TSecr=658251"
"144","3.131792397","10.0.0.1","10.0.0.2","TCP","1514","[TCP Out-Of-Order] 37598  >  34567 [ACK] Seq=165673 Ack=1 Win=29696 Len=1448 TSval=658289 TSecr=658264"
"145","3.141027168","10.0.0.2","10.0.0.1","TCP","86","[TCP Dup ACK 141#2] 34567  >  37598 [ACK] Seq=1 Ack=165673 Win=170496 Len=0 TSval=658282 TSecr=658220 SLE=174361 SRE=177257 SLE=168569 SRE=171465"
"146","3.204336508","10.0.0.1","10.0.0.2","TCP","1514","[TCP Out-Of-Order] 37598  >  34567 [ACK] Seq=167121 Ack=1 Win=29696 Len=1448 TSval=658307 TSecr=658282"
"147","3.215413501","10.0.0.1","10.0.0.2","TCP","1514","[TCP Out-Of-Order] 37598  >  34567 [ACK] Seq=171465 Ack=1 Win=29696 Len=1448 TSval=658307 TSecr=658282"
"148","3.245628673","10.0.0.2","10.0.0.1","TCP","86","[TCP Dup ACK 141#3] 34567  >  37598 [ACK] Seq=1 Ack=165673 Win=170496 Len=0 TSval=658308 TSecr=658220 SLE=174361 SRE=180153 SLE=168569 SRE=171465"
"149","3.282977034","10.0.0.2","10.0.0.1","TCP","86","34567  >  37598 [ACK] Seq=1 Ack=167121 Win=169472 Len=0 TSval=658318 TSecr=658289 SLE=174361 SRE=180153 SLE=168569 SRE=171465"
"150","3.308784236","10.0.0.1","10.0.0.2","TCP","1514","[TCP Retransmission] 37598  >  34567 [ACK] Seq=172913 Ack=1 Win=29696 Len=1448 TSval=658333 TSecr=658308"
"151","3.362820217","10.0.0.1","10.0.0.2","TCP","2962","[TCP Previous segment not captured] 37598  >  34567 [ACK] Seq=181601 Ack=1 Win=29696 Len=2896 TSval=658343 TSecr=658318"
"152","3.362832771","10.0.0.2","10.0.0.1","TCP","78","34567  >  37598 [ACK] Seq=1 Ack=171465 Win=165376 Len=0 TSval=658337 TSecr=658307 SLE=174361 SRE=180153"
"153","3.367807523","10.0.0.2","10.0.0.1","TCP","78","34567  >  37598 [ACK] Seq=1 Ack=172913 Win=167424 Len=0 TSval=658339 TSecr=658307 SLE=174361 SRE=180153"
"154","3.369836112","10.0.0.1","10.0.0.2","TCP","1514","37598  >  34567 [ACK] Seq=184497 Ack=1 Win=29696 Len=1448 TSval=658343 TSecr=658318"
"155","3.425369623","10.0.0.1","10.0.0.2","TCP","1514","37598  >  34567 [ACK] Seq=185945 Ack=1 Win=29696 Len=1448 TSval=658363 TSecr=658337"
"156","3.464941924","10.0.0.2","10.0.0.1","TCP","66","34567  >  37598 [ACK] Seq=1 Ack=180153 Win=167936 Len=0 TSval=658363 TSecr=658333"
"157","3.516696149","10.0.0.2","10.0.0.1","TCP","78","[TCP Window Update] 34567  >  37598 [ACK] Seq=1 Ack=180153 Win=170496 Len=0 TSval=658376 TSecr=658333 SLE=181601 SRE=184497"
"158","3.526489883","10.0.0.2","10.0.0.1","TCP","78","[TCP Dup ACK 156#1] 34567  >  37598 [ACK] Seq=1 Ack=180153 Win=170496 Len=0 TSval=658378 TSecr=658333 SLE=181601 SRE=185945"
"159","3.527224568","10.0.0.1","10.0.0.2","TCP","1514","[TCP Previous segment not captured] 37598  >  34567 [ACK] Seq=188841 Ack=1 Win=29696 Len=1448 TSval=658388 TSecr=658363"
"160","3.577289913","10.0.0.2","10.0.0.1","TCP","78","[TCP Dup ACK 156#2] 34567  >  37598 [ACK] Seq=1 Ack=180153 Win=170496 Len=0 TSval=658391 TSecr=658333 SLE=181601 SRE=187393"
"161","3.591362274","10.0.0.1","10.0.0.2","TCP","2962","37598  >  34567 [ACK] Seq=190289 Ack=1 Win=29696 Len=2896 TSval=658401 TSecr=658376"
"162","3.603934426","10.0.0.1","10.0.0.2","TCP","1514","[TCP Out-Of-Order] 37598  >  34567 [ACK] Seq=180153 Ack=1 Win=29696 Len=1448 TSval=658404 TSecr=658378"
"163","3.639771841","10.0.0.1","10.0.0.2","TCP","1514","37598  >  34567 [ACK] Seq=193185 Ack=1 Win=29696 Len=1448 TSval=658416 TSecr=658391"
"164","3.680522533","10.0.0.2","10.0.0.1","TCP","86","[TCP Dup ACK 156#3] 34567  >  37598 [ACK] Seq=1 Ack=180153 Win=170496 Len=0 TSval=658417 TSecr=658333 SLE=188841 SRE=190289 SLE=181601 SRE=187393"
"165","3.744184213","10.0.0.2","10.0.0.1","TCP","86","[TCP Dup ACK 156#4] 34567  >  37598 [ACK] Seq=1 Ack=180153 Win=170496 Len=0 TSval=658432 TSecr=658333 SLE=188841 SRE=193185 SLE=181601 SRE=187393"
"166","3.756299674","10.0.0.2","10.0.0.1","TCP","78","34567  >  37598 [ACK] Seq=1 Ack=187393 Win=164864 Len=0 TSval=658436 TSecr=658404 SLE=188841 SRE=193185"
"167","3.794624234","10.0.0.2","10.0.0.1","TCP","78","[TCP Window Update] 34567  >  37598 [ACK] Seq=1 Ack=187393 Win=167936 Len=0 TSval=658445 TSecr=658404 SLE=188841 SRE=194633"
"168","3.806682291","10.0.0.1","10.0.0.2","TCP","1514","[TCP Out-Of-Order] 37598  >  34567 [ACK] Seq=187393 Ack=1 Win=29696 Len=1448 TSval=658458 TSecr=658432"
"169","3.819694791","10.0.0.1","10.0.0.2","TCP","1514","37598  >  34567 [ACK] Seq=194633 Ack=1 Win=29696 Len=1448 TSval=658458 TSecr=658432"
"170","3.830804291","10.0.0.1","10.0.0.2","TCP","1514","37598  >  34567 [ACK] Seq=196081 Ack=1 Win=29696 Len=1448 TSval=658461 TSecr=658436"
"171","3.857236446","10.0.0.1","10.0.0.2","TCP","1514","37598  >  34567 [ACK] Seq=197529 Ack=1 Win=29696 Len=1448 TSval=658471 TSecr=658445"
"172","3.958534217","10.0.0.2","10.0.0.1","TCP","66","34567  >  37598 [ACK] Seq=1 Ack=194633 Win=167936 Len=0 TSval=658486 TSecr=658458"
"173","3.983847676","10.0.0.2","10.0.0.1","TCP","66","34567  >  37598 [ACK] Seq=1 Ack=197529 Win=170496 Len=0 TSval=658493 TSecr=658458"
"174","4.033488259","10.0.0.1","10.0.0.2","TCP","2962","37598  >  34567 [ACK] Seq=198977 Ack=1 Win=29696 Len=2896 TSval=658512 TSecr=658486"
"175","4.054355288","10.0.0.2","10.0.0.1","TCP","66","34567  >  37598 [ACK] Seq=1 Ack=198977 Win=170496 Len=0 TSval=658511 TSecr=658471"
"176","4.117282788","10.0.0.1","10.0.0.2","TCP","1514","[TCP Previous segment not captured] 37598  >  34567 [ACK] Seq=204769 Ack=1 Win=29696 Len=1448 TSval=658536 TSecr=658511"
"177","4.185069761","10.0.0.2","10.0.0.1","TCP","66","34567  >  37598 [ACK] Seq=1 Ack=201873 Win=170496 Len=0 TSval=658543 TSecr=658512"
"178","4.259537424","10.0.0.1","10.0.0.2","TCP","2962","37598  >  34567 [ACK] Seq=206217 Ack=1 Win=29696 Len=2896 TSval=658568 TSecr=658543"
"179","4.268535947","10.0.0.2","10.0.0.1","TCP","78","[TCP Dup ACK 177#1] 34567  >  37598 [ACK] Seq=1 Ack=201873 Win=170496 Len=0 TSval=658564 TSecr=658512 SLE=204769 SRE=206217"
"180","4.331539026","10.0.0.1","10.0.0.2","TCP","1514","37598  >  34567 [ACK] Seq=209113 Ack=1 Win=29696 Len=1448 TSval=658589 TSecr=658564"
"181","4.411262634","10.0.0.2","10.0.0.1","TCP","78","[TCP Dup ACK 177#2] 34567  >  37598 [ACK] Seq=1 Ack=201873 Win=170496 Len=0 TSval=658600 TSecr=658512 SLE=204769 SRE=209113"
"182","4.473887709","10.0.0.1","10.0.0.2","TCP","1514","[TCP Out-Of-Order] 37598  >  34567 [ACK] Seq=201873 Ack=1 Win=29696 Len=1448 TSval=658625 TSecr=658600"
"183","4.485888026","10.0.0.1","10.0.0.2","TCP","1514","[TCP Out-Of-Order] 37598  >  34567 [ACK] Seq=203321 Ack=1 Win=29696 Len=1448 TSval=658625 TSecr=658600"
"184","4.486679400","10.0.0.2","10.0.0.1","TCP","78","[TCP Dup ACK 177#3] 34567  >  37598 [ACK] Seq=1 Ack=201873 Win=170496 Len=0 TSval=658619 TSecr=658512 SLE=204769 SRE=210561"
"185","4.625690318","10.0.0.2","10.0.0.1","TCP","78","34567  >  37598 [ACK] Seq=1 Ack=203321 Win=169472 Len=0 TSval=658653 TSecr=658625 SLE=204769 SRE=210561"
"186","4.637714289","10.0.0.2","10.0.0.1","TCP","66","34567  >  37598 [ACK] Seq=1 Ack=210561 Win=168960 Len=0 TSval=658656 TSecr=658625"
"187","4.688458204","10.0.0.1","10.0.0.2","TCP","1514","[TCP Previous segment not captured] 37598  >  34567 [ACK] Seq=212009 Ack=1 Win=29696 Len=1448 TSval=658678 TSecr=658653"
"188","4.713864543","10.0.0.1","10.0.0.2","TCP","2962","37598  >  34567 [ACK] Seq=213457 Ack=1 Win=29696 Len=2896 TSval=658681 TSecr=658656"
"189","4.841138098","10.0.0.2","10.0.0.1","TCP","78","[TCP Window Update] 34567  >  37598 [ACK] Seq=1 Ack=210561 Win=170496 Len=0 TSval=658707 TSecr=658625 SLE=212009 SRE=213457"
"190","4.867339123","10.0.0.2","10.0.0.1","TCP","78","[TCP Dup ACK 186#1] 34567  >  37598 [ACK] Seq=1 Ack=210561 Win=170496 Len=0 TSval=658713 TSecr=658625 SLE=212009 SRE=216353"
"191","4.905178247","10.0.0.1","10.0.0.2","TCP","1514","37598  >  34567 [ACK] Seq=216353 Ack=1 Win=29696 Len=1448 TSval=658732 TSecr=658707"
"192","4.929902591","10.0.0.1","10.0.0.2","TCP","1514","[TCP Out-Of-Order] 37598  >  34567 [ACK] Seq=210561 Ack=1 Win=29696 Len=1448 TSval=658739 TSecr=658713"
"193","5.057466988","10.0.0.2","10.0.0.1","TCP","78","[TCP Dup ACK 186#2] 34567  >  37598 [ACK] Seq=1 Ack=210561 Win=170496 Len=0 TSval=658761 TSecr=658625 SLE=212009 SRE=217801"
"194","5.082694704","10.0.0.2","10.0.0.1","TCP","66","34567  >  37598 [ACK] Seq=1 Ack=217801 Win=168960 Len=0 TSval=658767 TSecr=658739"
"195","5.119765128","10.0.0.1","10.0.0.2","TCP","1514","37598  >  34567 [ACK] Seq=217801 Ack=1 Win=29696 Len=1448 TSval=658786 TSecr=658761"
"196","5.157158313","10.0.0.1","10.0.0.2","TCP","2962","37598  >  34567 [ACK] Seq=219249 Ack=1 Win=29696 Len=2896 TSval=658793 TSecr=658767"
"197","5.169368560","10.0.0.1","10.0.0.2","TCP","1514","37598  >  34567 [ACK] Seq=222145 Ack=1 Win=29696 Len=1448 TSval=658793 TSecr=658767"
"198","5.308307184","10.0.0.2","10.0.0.1","TCP","66","34567  >  37598 [ACK] Seq=1 Ack=222145 Win=170496 Len=0 TSval=658824 TSecr=658786"
"199","5.377471470","10.0.0.2","10.0.0.1","TCP","66","34567  >  37598 [ACK] Seq=1 Ack=223593 Win=170496 Len=0 TSval=658841 TSecr=658793"
"200","5.382889699","10.0.0.1","10.0.0.2","TCP","2962","37598  >  34567 [ACK] Seq=223593 Ack=1 Win=29696 Len=2896 TSval=658849 TSecr=658824"
"201","5.452073651","10.0.0.1","10.0.0.2","TCP","2962","37598  >  34567 [ACK] Seq=226489 Ack=1 Win=29696 Len=2896 TSval=658866 TSecr=658841"
"202","5.534418247","10.0.0.2","10.0.0.1","TCP","66","34567  >  37598 [ACK] Seq=1 Ack=226489 Win=170496 Len=0 TSval=658880 TSecr=658849"
"203","5.604958436","10.0.0.2","10.0.0.1","TCP","66","34567  >  37598 [ACK] Seq=1 Ack=229385 Win=170496 Len=0 TSval=658898 TSecr=658866"
"204","5.609044676","10.0.0.1","10.0.0.2","TCP","2962","37598  >  34567 [ACK] Seq=229385 Ack=1 Win=29696 Len=2896 TSval=658906 TSecr=658880"
"205","5.679833854","10.0.0.1","10.0.0.2","TCP","2962","37598  >  34567 [ACK] Seq=232281 Ack=1 Win=29696 Len=2896 TSval=658923 TSecr=658898"
"206","5.761422155","10.0.0.2","10.0.0.1","TCP","66","34567  >  37598 [ACK] Seq=1 Ack=232281 Win=170496 Len=0 TSval=658937 TSecr=658906"
"207","5.835876116","10.0.0.1","10.0.0.2","TCP","2962","37598  >  34567 [ACK] Seq=235177 Ack=1 Win=29696 Len=2896 TSval=658962 TSecr=658937"
"208","5.840802557","10.0.0.2","10.0.0.1","TCP","66","34567  >  37598 [ACK] Seq=1 Ack=235177 Win=170496 Len=0 TSval=658955 TSecr=658923"
"209","5.916021377","10.0.0.1","10.0.0.2","TCP","2962","37598  >  34567 [ACK] Seq=238073 Ack=1 Win=29696 Len=2896 TSval=658982 TSecr=658955"
"210","5.987579721","10.0.0.2","10.0.0.1","TCP","66","34567  >  37598 [ACK] Seq=1 Ack=238073 Win=170496 Len=0 TSval=658994 TSecr=658962"
"211","6.062626408","10.0.0.1","10.0.0.2","TCP","2962","37598  >  34567 [ACK] Seq=240969 Ack=1 Win=29696 Len=2896 TSval=659019 TSecr=658994"
"212","6.068519171","10.0.0.2","10.0.0.1","TCP","66","34567  >  37598 [ACK] Seq=1 Ack=240969 Win=170496 Len=0 TSval=659014 TSecr=658982"
"213","6.074451111","10.0.0.1","10.0.0.2","TCP","1514","37598  >  34567 [ACK] Seq=243865 Ack=1 Win=29696 Len=1448 TSval=659019 TSecr=658994"
"214","6.143010744","10.0.0.1","10.0.0.2","TCP","2962","37598  >  34567 [ACK] Seq=245313 Ack=1 Win=29696 Len=2896 TSval=659039 TSecr=659014"
"215","6.215101435","10.0.0.2","10.0.0.1","TCP","66","34567  >  37598 [ACK] Seq=1 Ack=243865 Win=170496 Len=0 TSval=659051 TSecr=659019"
"216","6.294132126","10.0.0.2","10.0.0.1","TCP","66","34567  >  37598 [ACK] Seq=1 Ack=248209 Win=170496 Len=0 TSval=659070 TSecr=659019"
"217","6.368658395","10.0.0.1","10.0.0.2","TCP","2962","[TCP Previous segment not captured] 37598  >  34567 [ACK] Seq=251105 Ack=1 Win=29696 Len=2896 TSval=659096 TSecr=659070"
"218","6.381672720","10.0.0.1","10.0.0.2","TCP","1514","37598  >  34567 [ACK] Seq=254001 Ack=1 Win=29696 Len=1448 TSval=659096 TSecr=659070"
"219","6.520958533","10.0.0.2","10.0.0.1","TCP","78","[TCP Dup ACK 216#1] 34567  >  37598 [ACK] Seq=1 Ack=248209 Win=170496 Len=0 TSval=659127 TSecr=659019 SLE=251105 SRE=254001"
"220","6.533589062","10.0.0.2","10.0.0.1","TCP","78","[TCP Dup ACK 216#2] 34567  >  37598 [ACK] Seq=1 Ack=248209 Win=170496 Len=0 TSval=659130 TSecr=659019 SLE=251105 SRE=255449"
"221","6.583352419","10.0.0.1","10.0.0.2","TCP","1514","[TCP Out-Of-Order] 37598  >  34567 [ACK] Seq=248209 Ack=1 Win=29696 Len=1448 TSval=659152 TSecr=659127"
"222","6.596287022","10.0.0.1","10.0.0.2","TCP","1514","[TCP Retransmission] 37598  >  34567 [ACK] Seq=249657 Ack=1 Win=29696 Len=1448 TSval=659155 TSecr=659130"
"223","6.735804161","10.0.0.2","10.0.0.1","TCP","78","34567  >  37598 [ACK] Seq=1 Ack=249657 Win=169472 Len=0 TSval=659180 TSecr=659152 SLE=251105 SRE=255449"
"224","6.747274125","10.0.0.2","10.0.0.1","TCP","66","34567  >  37598 [ACK] Seq=1 Ack=255449 Win=169472 Len=0 TSval=659184 TSecr=659155"
"225","6.798638086","10.0.0.1","10.0.0.2","TCP","1514","37598  >  34567 [ACK] Seq=255449 Ack=1 Win=29696 Len=1448 TSval=659206 TSecr=659180"
"226","6.810251694","10.0.0.1","10.0.0.2","TCP","1514","37598  >  34567 [ACK] Seq=256897 Ack=1 Win=29696 Len=1448 TSval=659206 TSecr=659180"
"227","6.834785541","10.0.0.1","10.0.0.2","TCP","2962","37598  >  34567 [ACK] Seq=258345 Ack=1 Win=29696 Len=2896 TSval=659209 TSecr=659184"
"228","6.961940380","10.0.0.2","10.0.0.1","TCP","66","34567  >  37598 [ACK] Seq=1 Ack=258345 Win=170496 Len=0 TSval=659237 TSecr=659206"
"229","6.986373871","10.0.0.2","10.0.0.1","TCP","66","34567  >  37598 [ACK] Seq=1 Ack=261241 Win=170496 Len=0 TSval=659243 TSecr=659209"
"230","7.037658563","10.0.0.1","10.0.0.2","TCP","2962","37598  >  34567 [ACK] Seq=261241 Ack=1 Win=29696 Len=2896 TSval=659263 TSecr=659237"
"231","7.061336300","10.0.0.1","10.0.0.2","TCP","2962","37598  >  34567 [ACK] Seq=264137 Ack=1 Win=29696 Len=2896 TSval=659269 TSecr=659243"
"232","7.074216874","10.0.0.1","10.0.0.2","TCP","1514","37598  >  34567 [ACK] Seq=267033 Ack=1 Win=29696 Len=1448 TSval=659269 TSecr=659243"
"233","7.189499375","10.0.0.2","10.0.0.1","TCP","66","34567  >  37598 [ACK] Seq=1 Ack=264137 Win=170496 Len=0 TSval=659294 TSecr=659263"
"234","7.213671394","10.0.0.2","10.0.0.1","TCP","66","34567  >  37598 [ACK] Seq=1 Ack=267033 Win=170496 Len=0 TSval=659300 TSecr=659269"
"235","7.264324730","10.0.0.1","10.0.0.2","TCP","2962","37598  >  34567 [ACK] Seq=268481 Ack=1 Win=29696 Len=2896 TSval=659319 TSecr=659294"
"236","7.268351823","10.0.0.2","10.0.0.1","TCP","66","34567  >  37598 [ACK] Seq=1 Ack=268481 Win=170496 Len=0 TSval=659314 TSecr=659269"
"237","7.293652337","10.0.0.1","10.0.0.2","TCP","2962","37598  >  34567 [ACK] Seq=271377 Ack=1 Win=29696 Len=2896 TSval=659325 TSecr=659300"
"238","7.330736756","10.0.0.1","10.0.0.2","TCP","1514","37598  >  34567 [ACK] Seq=274273 Ack=1 Win=29696 Len=1448 TSval=659339 TSecr=659314"
"239","7.415765290","10.0.0.2","10.0.0.1","TCP","66","34567  >  37598 [ACK] Seq=1 Ack=271377 Win=170496 Len=0 TSval=659351 TSecr=659319"
"240","7.445633149","10.0.0.2","10.0.0.1","TCP","66","34567  >  37598 [ACK] Seq=1 Ack=274273 Win=170496 Len=0 TSval=659358 TSecr=659325"
"241","7.490536679","10.0.0.1","10.0.0.2","TCP","2962","37598  >  34567 [ACK] Seq=275721 Ack=1 Win=29696 Len=2896 TSval=659376 TSecr=659351"
"242","7.520323639","10.0.0.1","10.0.0.2","TCP","2962","37598  >  34567 [ACK] Seq=278617 Ack=1 Win=29696 Len=2896 TSval=659384 TSecr=659358"
"243","7.551205228","10.0.0.2","10.0.0.1","TCP","66","34567  >  37598 [ACK] Seq=1 Ack=275721 Win=170496 Len=0 TSval=659385 TSecr=659339"
"244","7.613722131","10.0.0.1","10.0.0.2","TCP","1514","37598  >  34567 [ACK] Seq=281513 Ack=1 Win=29696 Len=1448 TSval=659410 TSecr=659385"
"245","7.642560608","10.0.0.2","10.0.0.1","TCP","66","34567  >  37598 [ACK] Seq=1 Ack=278617 Win=170496 Len=0 TSval=659407 TSecr=659376"
"246","7.672794973","10.0.0.2","10.0.0.1","TCP","66","34567  >  37598 [ACK] Seq=1 Ack=281513 Win=170496 Len=0 TSval=659415 TSecr=659384"
"247","7.718538520","10.0.0.1","10.0.0.2","TCP","2962","37598  >  34567 [ACK] Seq=282961 Ack=1 Win=29696 Len=2896 TSval=659433 TSecr=659407"
"248","7.748317394","10.0.0.1","10.0.0.2","TCP","2962","37598  >  34567 [ACK] Seq=285857 Ack=1 Win=29696 Len=2896 TSval=659440 TSecr=659415"
"249","7.870249794","10.0.0.2","10.0.0.1","TCP","66","34567  >  37598 [ACK] Seq=1 Ack=285857 Win=170496 Len=0 TSval=659464 TSecr=659410"
"250","7.901313144","10.0.0.2","10.0.0.1","TCP","66","34567  >  37598 [ACK] Seq=1 Ack=288753 Win=170496 Len=0 TSval=659472 TSecr=659440"
"251","7.977188179","10.0.0.1","10.0.0.2","TCP","2962","[TCP Previous segment not captured] 37598  >  34567 [ACK] Seq=291649 Ack=1 Win=29696 Len=2896 TSval=659498 TSecr=659472"
"252","7.989349748","10.0.0.1","10.0.0.2","TCP","1514","37598  >  34567 [ACK] Seq=294545 Ack=1 Win=29696 Len=1448 TSval=659498 TSecr=659472"
"253","8.130641899","10.0.0.2","10.0.0.1","TCP","78","[TCP Dup ACK 250#1] 34567  >  37598 [ACK] Seq=1 Ack=288753 Win=170496 Len=0 TSval=659529 TSecr=659440 SLE=291649 SRE=294545"
"254","8.140956358","10.0.0.2","10.0.0.1","TCP","78","[TCP Dup ACK 250#2] 34567  >  37598 [ACK] Seq=1 Ack=288753 Win=170496 Len=0 TSval=659532 TSecr=659440 SLE=291649 SRE=295993"
"255","8.193150984","10.0.0.1","10.0.0.2","TCP","1514","[TCP Out-Of-Order] 37598  >  34567 [ACK] Seq=288753 Ack=1 Win=29696 Len=1448 TSval=659555 TSecr=659529"
"256","8.205407633","10.0.0.1","10.0.0.2","TCP","1514","[TCP Retransmission] 37598  >  34567 [ACK] Seq=290201 Ack=1 Win=29696 Len=1448 TSval=659557 TSecr=659532"
"257","8.347256983","10.0.0.2","10.0.0.1","TCP","78","34567  >  37598 [ACK] Seq=1 Ack=290201 Win=169472 Len=0 TSval=659583 TSecr=659555 SLE=291649 SRE=295993"
"258","8.356681786","10.0.0.2","10.0.0.1","TCP","66","34567  >  37598 [ACK] Seq=1 Ack=295993 Win=169472 Len=0 TSval=659586 TSecr=659557"
"259","8.410656610","10.0.0.1","10.0.0.2","TCP","1514","37598  >  34567 [ACK] Seq=295993 Ack=1 Win=29696 Len=1448 TSval=659609 TSecr=659583"
"260","8.422435682","10.0.0.1","10.0.0.2","TCP","1514","37598  >  34567 [ACK] Seq=297441 Ack=1 Win=29696 Len=1448 TSval=659609 TSecr=659583"
"261","8.446528206","10.0.0.1","10.0.0.2","TCP","2962","37598  >  34567 [ACK] Seq=298889 Ack=1 Win=29696 Len=2896 TSval=659611 TSecr=659586"
"262","8.574026668","10.0.0.2","10.0.0.1","TCP","66","34567  >  37598 [ACK] Seq=1 Ack=298889 Win=170496 Len=0 TSval=659640 TSecr=659609"
"263","8.598579626","10.0.0.2","10.0.0.1","TCP","66","34567  >  37598 [ACK] Seq=1 Ack=301785 Win=170496 Len=0 TSval=659646 TSecr=659611"
"264","8.649313422","10.0.0.1","10.0.0.2","TCP","2962","37598  >  34567 [ACK] Seq=301785 Ack=1 Win=29696 Len=2896 TSval=659666 TSecr=659640"
"265","8.673753886","10.0.0.1","10.0.0.2","TCP","2962","37598  >  34567 [ACK] Seq=304681 Ack=1 Win=29696 Len=2896 TSval=659672 TSecr=659646"
"266","8.807100815","10.0.0.2","10.0.0.1","TCP","66","34567  >  37598 [ACK] Seq=1 Ack=304681 Win=170496 Len=0 TSval=659697 TSecr=659666"
"267","8.824836817","10.0.0.2","10.0.0.1","TCP","66","34567  >  37598 [ACK] Seq=1 Ack=307577 Win=170496 Len=0 TSval=659703 TSecr=659672"
