"No.","Time","Source","Destination","Protocol","Length","Info"
"1","0.000000000","10.0.0.1","10.0.0.2","TCP","74","37598  >  34567 [SYN] Seq=0 Win=29200 Len=0 MSS=1460 SACK_PERM=1 TSval=657509 TSecr=0 WS=512"
"2","24.965700723","10.0.0.3","10.0.0.2","TCP","74","43740  >  34568 [SYN] Seq=0 Win=29200 Len=0 MSS=1460 SACK_PERM=1 TSval=663764 TSecr=0 WS=512"
"3","25.121028315","10.0.0.2","10.0.0.3","TCP","74","34568  >  43740 [SYN, ACK] Seq=0 Ack=1 Win=28960 Len=0 MSS=1460 SACK_PERM=1 TSval=663789 TSecr=663764 WS=512"
"4","25.171714519","10.0.0.3","10.0.0.2","TCP","66","43740  >  34568 [ACK] Seq=1 Ack=1 Win=29696 Len=0 TSval=663815 TSecr=663789"
"5","25.189229740","10.0.0.3","10.0.0.2","TCP","2114","43740  >  34568 [PSH, ACK] Seq=1 Ack=1 Win=29696 Len=2048 TSval=663815 TSecr=663789"
"6","25.201537292","10.0.0.3","10.0.0.2","TCP","1514","43740  >  34568 [ACK] Seq=2049 Ack=1 Win=29696 Len=1448 TSval=663815 TSecr=663789"
"7","25.214078866","10.0.0.3","10.0.0.2","TCP","1514","43740  >  34568 [ACK] Seq=3497 Ack=1 Win=29696 Len=1448 TSval=663815 TSecr=663789"
"8","25.237770179","10.0.0.3","10.0.0.2","TCP","2962","43740  >  34568 [ACK] Seq=4945 Ack=1 Win=29696 Len=2896 TSval=663815 TSecr=663789"
"9","25.249938520","10.0.0.3","10.0.0.2","TCP","1514","43740  >  34568 [ACK] Seq=7841 Ack=1 Win=29696 Len=1448 TSval=663815 TSecr=663789"
"10","25.274658134","10.0.0.3","10.0.0.2","TCP","2962","43740  >  34568 [ACK] Seq=9289 Ack=1 Win=29696 Len=2896 TSval=663815 TSecr=663789"
"11","25.286175404","10.0.0.3","10.0.0.2","TCP","1514","43740  >  34568 [ACK] Seq=12185 Ack=1 Win=29696 Len=1448 TSval=663815 TSecr=663789"
"12","25.346364730","10.0.0.2","10.0.0.3","TCP","66","34568  >  43740 [ACK] Seq=1 Ack=2049 Win=33280 Len=0 TSval=663846 TSecr=663815"
"13","25.375460616","10.0.0.2","10.0.0.3","TCP","66","34568  >  43740 [ACK] Seq=1 Ack=3497 Win=36352 Len=0 TSval=663854 TSecr=663815"
"14","25.387198780","10.0.0.2","10.0.0.3","TCP","66","34568  >  43740 [ACK] Seq=1 Ack=4945 Win=38912 Len=0 TSval=663856 TSecr=663815"
"15","25.399632045","10.0.0.2","10.0.0.3","TCP","66","34568  >  43740 [ACK] Seq=1 Ack=7841 Win=45056 Len=0 TSval=663859 TSecr=663815"
"16","25.420893368","10.0.0.3","10.0.0.2","TCP","2962","43740  >  34568 [ACK] Seq=13633 Ack=1 Win=29696 Len=2896 TSval=663871 TSecr=663846"
"17","25.423415871","10.0.0.2","10.0.0.3","TCP","66","34568  >  43740 [ACK] Seq=1 Ack=9289 Win=47616 Len=0 TSval=663866 TSecr=663815"
"18","25.435415672","10.0.0.2","10.0.0.3","TCP","66","34568  >  43740 [ACK] Seq=1 Ack=12185 Win=53760 Len=0 TSval=663869 TSecr=663815"
"19","25.445280126","10.0.0.3","10.0.0.2","TCP","2962","43740  >  34568 [ACK] Seq=16529 Ack=1 Win=29696 Len=2896 TSval=663871 TSecr=663846"
"20","25.459801418","10.0.0.2","10.0.0.3","TCP","66","34568  >  43740 [ACK] Seq=1 Ack=13633 Win=56320 Len=0 TSval=663875 TSecr=663815"
"21","25.469155532","10.0.0.3","10.0.0.2","TCP","2962","43740  >  34568 [ACK] Seq=19425 Ack=1 Win=29696 Len=2896 TSval=663879 TSecr=663854"
"22","25.494601011","10.0.0.3","10.0.0.2","TCP","2962","43740  >  34568 [ACK] Seq=22321 Ack=1 Win=29696 Len=2896 TSval=663882 TSecr=663856"
"23","25.517671093","10.0.0.3","10.0.0.2","TCP","2962","43740  >  34568 [ACK] Seq=25217 Ack=1 Win=29696 Len=2896 TSval=663885 TSecr=663859"
"24","25.545724297","10.0.0.3","10.0.0.2","TCP","2962","43740  >  34568 [ACK] Seq=28113 Ack=1 Win=29696 Len=2896 TSval=663885 TSecr=663859"
"25","25.567190810","10.0.0.3","10.0.0.2","TCP","2962","43740  >  34568 [ACK] Seq=31009 Ack=1 Win=29696 Len=2896 TSval=663891 TSecr=663866"
"26","25.572198786","10.0.0.2","10.0.0.3","TCP","66","34568  >  43740 [ACK] Seq=1 Ack=16529 Win=62464 Len=0 TSval=663903 TSecr=663871"
"27","25.590880654","10.0.0.3","10.0.0.2","TCP","2962","43740  >  34568 [ACK] Seq=33905 Ack=1 Win=29696 Len=2896 TSval=663894 TSecr=663869"
"28","25.598122164","10.0.0.2","10.0.0.3","TCP","66","34568  >  43740 [ACK] Seq=1 Ack=19425 Win=68096 Len=0 TSval=663909 TSecr=663871"
"29","25.614967702","10.0.0.3","10.0.0.2","TCP","2962","43740  >  34568 [ACK] Seq=36801 Ack=1 Win=29696 Len=2896 TSval=663894 TSecr=663869"
"30","25.621301367","10.0.0.2","10.0.0.3","TCP","66","34568  >  43740 [ACK] Seq=1 Ack=22321 Win=73728 Len=0 TSval=663915 TSecr=663879"
"31","25.638901509","10.0.0.3","10.0.0.2","TCP","2962","43740  >  34568 [ACK] Seq=39697 Ack=1 Win=29696 Len=2896 TSval=663900 TSecr=663875"
"32","25.647120706","10.0.0.2","10.0.0.3","TCP","66","34568  >  43740 [ACK] Seq=1 Ack=25217 Win=79872 Len=0 TSval=663921 TSecr=663882"
"33","25.662998306","10.0.0.3","10.0.0.2","TCP","2962","43740  >  34568 [ACK] Seq=42593 Ack=1 Win=29696 Len=2896 TSval=663928 TSecr=663903"
"34","25.669860431","10.0.0.2","10.0.0.3","TCP","66","34568  >  43740 [ACK] Seq=1 Ack=28113 Win=85504 Len=0 TSval=663927 TSecr=663885"
"35","25.687546861","10.0.0.3","10.0.0.2","TCP","2962","43740  >  34568 [ACK] Seq=45489 Ack=1 Win=29696 Len=2896 TSval=663928 TSecr=663903"
"36","25.697467426","10.0.0.2","10.0.0.3","TCP","66","34568  >  43740 [ACK] Seq=1 Ack=31009 Win=91136 Len=0 TSval=663934 TSecr=663885"
"37","25.711428193","10.0.0.3","10.0.0.2","TCP","2962","43740  >  34568 [ACK] Seq=48385 Ack=1 Win=29696 Len=2896 TSval=663934 TSecr=663909"
"38","25.730212290","10.0.0.2","10.0.0.3","TCP","66","34568  >  43740 [ACK] Seq=1 Ack=33905 Win=96768 Len=0 TSval=663942 TSecr=663891"
"39","25.736056224","10.0.0.3","10.0.0.2","TCP","2962","43740  >  34568 [ACK] Seq=51281 Ack=1 Win=29696 Len=2896 TSval=663934 TSecr=663909"
"40","25.760298367","10.0.0.3","10.0.0.2","TCP","2962","43740  >  34568 [ACK] Seq=54177 Ack=1 Win=29696 Len=2896 TSval=663940 TSecr=663915"
"41","25.779434163","10.0.0.2","10.0.0.3","TCP","66","34568  >  43740 [ACK] Seq=1 Ack=36801 Win=102912 Len=0 TSval=663954 TSecr=663894"
"42","25.784878142","10.0.0.3","10.0.0.2","TCP","2962","43740  >  34568 [ACK] Seq=57073 Ack=1 Win=29696 Len=2896 TSval=663940 TSecr=663915"
"43","25.804917044","10.0.0.2","10.0.0.3","TCP","66","34568  >  43740 [ACK] Seq=1 Ack=39697 Win=108544 Len=0 TSval=663961 TSecr=663894"
"44","25.808417555","10.0.0.3","10.0.0.2","TCP","2962","43740  >  34568 [ACK] Seq=59969 Ack=1 Win=29696 Len=2896 TSval=663947 TSecr=663921"
"45","25.833349443","10.0.0.3","10.0.0.2","TCP","2962","43740  >  34568 [ACK] Seq=62865 Ack=1 Win=29696 Len=2896 TSval=663947 TSecr=663921"
"46","25.851648393","10.0.0.2","10.0.0.3","TCP","66","34568  >  43740 [ACK] Seq=1 Ack=42593 Win=114176 Len=0 TSval=663972 TSecr=663900"
"47","25.856804851","10.0.0.3","10.0.0.2","TCP","2962","43740  >  34568 [ACK] Seq=65761 Ack=1 Win=29696 Len=2896 TSval=663952 TSecr=663927"
"48","25.883125333","10.0.0.3","10.0.0.2","TCP","2962","43740  >  34568 [ACK] Seq=68657 Ack=1 Win=29696 Len=2896 TSval=663952 TSecr=663927"
"49","25.889157034","10.0.0.2","10.0.0.3","TCP","66","34568  >  43740 [ACK] Seq=1 Ack=45489 Win=120320 Len=0 TSval=663982 TSecr=663928"
"50","25.907457046","10.0.0.3","10.0.0.2","TCP","2962","43740  >  34568 [ACK] Seq=71553 Ack=1 Win=29696 Len=2896 TSval=663959 TSecr=663934"
"51","25.911218223","10.0.0.2","10.0.0.3","TCP","66","34568  >  43740 [ACK] Seq=1 Ack=48385 Win=125952 Len=0 TSval=663988 TSecr=663928"
"52","25.929547815","10.0.0.3","10.0.0.2","TCP","2962","43740  >  34568 [ACK] Seq=74449 Ack=1 Win=29696 Len=2896 TSval=663959 TSecr=663934"
"53","25.935516627","10.0.0.2","10.0.0.3","TCP","66","34568  >  43740 [ACK] Seq=1 Ack=51281 Win=131584 Len=0 TSval=663994 TSecr=663934"
"54","25.953908985","10.0.0.3","10.0.0.2","TCP","2962","43740  >  34568 [ACK] Seq=77345 Ack=1 Win=29696 Len=2896 TSval=663968 TSecr=663942"
"55","25.961748236","10.0.0.2","10.0.0.3","TCP","66","34568  >  43740 [ACK] Seq=1 Ack=54177 Win=137728 Len=0 TSval=664000 TSecr=663934"
"56","25.978749129","10.0.0.3","10.0.0.2","TCP","2962","43740  >  34568 [ACK] Seq=80241 Ack=1 Win=29696 Len=2896 TSval=663968 TSecr=663942"
"57","25.985055722","10.0.0.2","10.0.0.3","TCP","66","34568  >  43740 [ACK] Seq=1 Ack=57073 Win=143360 Len=0 TSval=664006 TSecr=663940"
"58","26.002475803","10.0.0.3","10.0.0.2","TCP","2962","43740  >  34568 [PSH, ACK] Seq=83137 Ack=1 Win=29696 Len=2896 TSval=663980 TSecr=663954"
"59","26.012845536","10.0.0.2","10.0.0.3","TCP","66","34568  >  43740 [ACK] Seq=1 Ack=59969 Win=148992 Len=0 TSval=664012 TSecr=663940"
"60","26.019912434","10.0.0.3","10.0.0.2","TCP","2098","43740  >  34568 [PSH, ACK] Seq=86033 Ack=1 Win=29696 Len=2032 TSval=663980 TSecr=663954"
"61","26.034937830","10.0.0.2","10.0.0.3","TCP","66","34568  >  43740 [ACK] Seq=1 Ack=62865 Win=155136 Len=0 TSval=664018 TSecr=663947"
"62","26.044371249","10.0.0.3","10.0.0.2","TCP","2962","43740  >  34568 [ACK] Seq=88065 Ack=1 Win=29696 Len=2896 TSval=663986 TSecr=663961"
"63","26.068783405","10.0.0.3","10.0.0.2","TCP","2962","43740  >  34568 [ACK] Seq=90961 Ack=1 Win=29696 Len=2896 TSval=663986 TSecr=663961"
"64","26.082016369","10.0.0.2","10.0.0.3","TCP","66","34568  >  43740 [ACK] Seq=1 Ack=65761 Win=160768 Len=0 TSval=664030 TSecr=663947"
"65","26.092291373","10.0.0.3","10.0.0.2","TCP","2962","43740  >  34568 [ACK] Seq=93857 Ack=1 Win=29696 Len=2896 TSval=663998 TSecr=663972"
"66","26.105863537","10.0.0.2","10.0.0.3","TCP","66","34568  >  43740 [ACK] Seq=1 Ack=68657 Win=166400 Len=0 TSval=664036 TSecr=663952"
"67","26.116669089","10.0.0.3","10.0.0.2","TCP","2962","43740  >  34568 [ACK] Seq=96753 Ack=1 Win=29696 Len=2896 TSval=664007 TSecr=663982"
"68","26.131548406","10.0.0.2","10.0.0.3","TCP","66","34568  >  43740 [ACK] Seq=1 Ack=71553 Win=170496 Len=0 TSval=664042 TSecr=663952"
"69","26.141191960","10.0.0.3","10.0.0.2","TCP","2962","43740  >  34568 [ACK] Seq=99649 Ack=1 Win=29696 Len=2896 TSval=664013 TSecr=663988"
"70","26.165100158","10.0.0.3","10.0.0.2","TCP","2962","43740  >  34568 [ACK] Seq=102545 Ack=1 Win=29696 Len=2896 TSval=664019 TSecr=663994"
"71","26.179636198","10.0.0.2","10.0.0.3","TCP","66","34568  >  43740 [ACK] Seq=1 Ack=74449 Win=170496 Len=0 TSval=664054 TSecr=663959"
"72","26.188989551","10.0.0.3","10.0.0.2","TCP","2962","43740  >  34568 [ACK] Seq=105441 Ack=1 Win=29696 Len=2896 TSval=664026 TSecr=664000"
"73","26.205951189","10.0.0.2","10.0.0.3","TCP","66","34568  >  43740 [ACK] Seq=1 Ack=77345 Win=170496 Len=0 TSval=664060 TSecr=663959"
"74","26.213434729","10.0.0.3","10.0.0.2","TCP","2962","43740  >  34568 [ACK] Seq=108337 Ack=1 Win=29696 Len=2896 TSval=664031 TSecr=664006"
"75","26.225929220","10.0.0.2","10.0.0.3","TCP","66","34568  >  43740 [ACK] Seq=1 Ack=80241 Win=170496 Len=0 TSval=664066 TSecr=663968"
"76","26.238450402","10.0.0.3","10.0.0.2","TCP","2962","43740  >  34568 [ACK] Seq=111233 Ack=1 Win=29696 Len=2896 TSval=664038 TSecr=664012"
"77","26.250524434","10.0.0.2","10.0.0.3","TCP","66","34568  >  43740 [ACK] Seq=1 Ack=83137 Win=170496 Len=0 TSval=664072 TSecr=663968"
"78","26.261793366","10.0.0.3","10.0.0.2","TCP","2962","43740  >  34568 [ACK] Seq=114129 Ack=1 Win=29696 Len=2896 TSval=664044 TSecr=664018"
"79","26.275173650","10.0.0.2","10.0.0.3","TCP","66","34568  >  43740 [ACK] Seq=1 Ack=86033 Win=170496 Len=0 TSval=664078 TSecr=663980"
"80","26.286047472","10.0.0.3","10.0.0.2","TCP","2962","43740  >  34568 [ACK] Seq=117025 Ack=1 Win=29696 Len=2896 TSval=664055 TSecr=664030"
"81","26.299819470","10.0.0.2","10.0.0.3","TCP","66","34568  >  43740 [ACK] Seq=1 Ack=88065 Win=170496 Len=0 TSval=664084 TSecr=663980"
"82","26.310416181","10.0.0.3","10.0.0.2","TCP","2962","43740  >  34568 [ACK] Seq=119921 Ack=1 Win=29696 Len=2896 TSval=664061 TSecr=664036"
"83","26.316700657","10.0.0.2","10.0.0.3","TCP","66","34568  >  43740 [ACK] Seq=1 Ack=90961 Win=170496 Len=0 TSval=664089 TSecr=663986"
"84","26.334651565","10.0.0.3","10.0.0.2","TCP","2962","43740  >  34568 [ACK] Seq=122817 Ack=1 Win=29696 Len=2896 TSval=664068 TSecr=664042"
"85","26.340371630","10.0.0.2","10.0.0.3","TCP","66","34568  >  43740 [ACK] Seq=1 Ack=93857 Win=170496 Len=0 TSval=664095 TSecr=663986"
"86","26.361261447","10.0.0.3","10.0.0.2","TCP","2962","43740  >  34568 [ACK] Seq=125713 Ack=1 Win=29696 Len=2896 TSval=664080 TSecr=664054"
"87","26.382945043","10.0.0.3","10.0.0.2","TCP","2962","43740  >  34568 [ACK] Seq=128609 Ack=1 Win=29696 Len=2896 TSval=664086 TSecr=664060"
"88","26.390475598","10.0.0.2","10.0.0.3","TCP","66","34568  >  43740 [ACK] Seq=1 Ack=96753 Win=170496 Len=0 TSval=664107 TSecr=663998"
"89","26.407187893","10.0.0.3","10.0.0.2","TCP","2962","43740  >  34568 [ACK] Seq=131505 Ack=1 Win=29696 Len=2896 TSval=664091 TSecr=664066"
"90","26.414627990","10.0.0.2","10.0.0.3","TCP","66","34568  >  43740 [ACK] Seq=1 Ack=99649 Win=176640 Len=0 TSval=664113 TSecr=664007"
"91","26.431906321","10.0.0.3","10.0.0.2","TCP","2962","43740  >  34568 [ACK] Seq=134401 Ack=1 Win=29696 Len=2896 TSval=664098 TSecr=664072"
"92","26.443561263","10.0.0.3","10.0.0.2","TCP","1514","43740  >  34568 [ACK] Seq=137297 Ack=1 Win=29696 Len=1448 TSval=664098 TSecr=664072"
"93","26.462805022","10.0.0.2","10.0.0.3","TCP","66","34568  >  43740 [ACK] Seq=1 Ack=102545 Win=182272 Len=0 TSval=664125 TSecr=664013"
"94","26.468493507","10.0.0.3","10.0.0.2","TCP","2962","43740  >  34568 [ACK] Seq=138745 Ack=1 Win=29696 Len=2896 TSval=664104 TSecr=664078"
"95","26.492128516","10.0.0.3","10.0.0.2","TCP","2962","43740  >  34568 [ACK] Seq=141641 Ack=1 Win=29696 Len=2896 TSval=664110 TSecr=664084"
"96","26.499176238","10.0.0.2","10.0.0.3","TCP","66","34568  >  43740 [ACK] Seq=1 Ack=105441 Win=187904 Len=0 TSval=664134 TSecr=664019"
"97","26.516999989","10.0.0.3","10.0.0.2","TCP","2962","43740  >  34568 [ACK] Seq=144537 Ack=1 Win=29696 Len=2896 TSval=664114 TSecr=664089"
"98","26.522113285","10.0.0.2","10.0.0.3","TCP","66","34568  >  43740 [ACK] Seq=1 Ack=108337 Win=194048 Len=0 TSval=664140 TSecr=664026"
"99","26.540254460","10.0.0.3","10.0.0.2","TCP","2962","43740  >  34568 [ACK] Seq=147433 Ack=1 Win=29696 Len=2896 TSval=664120 TSecr=664095"
"100","26.546422856","10.0.0.2","10.0.0.3","TCP","66","34568  >  43740 [ACK] Seq=1 Ack=111233 Win=199680 Len=0 TSval=664146 TSecr=664031"
"101","26.564907304","10.0.0.3","10.0.0.2","TCP","2962","43740  >  34568 [ACK] Seq=150329 Ack=1 Win=29696 Len=2896 TSval=664132 TSecr=664107"
"102","26.589025025","10.0.0.3","10.0.0.2","TCP","2962","[TCP Previous segment not captured] 43740  >  34568 [ACK] Seq=156121 Ack=1 Win=29696 Len=2896 TSval=664151 TSecr=664125"
"103","26.596739854","10.0.0.2","10.0.0.3","TCP","66","34568  >  43740 [ACK] Seq=1 Ack=114129 Win=205312 Len=0 TSval=664159 TSecr=664038"
"104","26.612902545","10.0.0.3","10.0.0.2","TCP","2962","43740  >  34568 [ACK] Seq=159017 Ack=1 Win=29696 Len=2896 TSval=664160 TSecr=664134"
"105","26.618802481","10.0.0.2","10.0.0.3","TCP","66","34568  >  43740 [ACK] Seq=1 Ack=117025 Win=210944 Len=0 TSval=664164 TSecr=664044"
"106","26.637921460","10.0.0.3","10.0.0.2","TCP","2962","43740  >  34568 [ACK] Seq=161913 Ack=1 Win=29696 Len=2896 TSval=664165 TSecr=664140"
"107","26.643644504","10.0.0.2","10.0.0.3","TCP","66","34568  >  43740 [ACK] Seq=1 Ack=119921 Win=217088 Len=0 TSval=664171 TSecr=664055"
"108","26.661349706","10.0.0.3","10.0.0.2","TCP","2962","43740  >  34568 [ACK] Seq=164809 Ack=1 Win=29696 Len=2896 TSval=664172 TSecr=664146"
"109","26.668857035","10.0.0.2","10.0.0.3","TCP","66","34568  >  43740 [ACK] Seq=1 Ack=122817 Win=222720 Len=0 TSval=664177 TSecr=664061"
"110","26.686614953","10.0.0.3","10.0.0.2","TCP","2962","43740  >  34568 [ACK] Seq=167705 Ack=1 Win=29696 Len=2896 TSval=664184 TSecr=664159"
"111","26.691618604","10.0.0.2","10.0.0.3","TCP","66","34568  >  43740 [ACK] Seq=1 Ack=125713 Win=228352 Len=0 TSval=664183 TSecr=664068"
"112","26.710323121","10.0.0.3","10.0.0.2","TCP","2962","43740  >  34568 [ACK] Seq=170601 Ack=1 Win=29696 Len=2896 TSval=664190 TSecr=664164"
"113","26.716682435","10.0.0.2","10.0.0.3","TCP","66","34568  >  43740 [ACK] Seq=1 Ack=128609 Win=234496 Len=0 TSval=664189 TSecr=664080"
"114","26.734202298","10.0.0.3","10.0.0.2","TCP","2962","43740  >  34568 [ACK] Seq=173497 Ack=1 Win=29696 Len=2896 TSval=664196 TSecr=664171"
"115","26.740917274","10.0.0.2","10.0.0.3","TCP","66","34568  >  43740 [ACK] Seq=1 Ack=131505 Win=238080 Len=0 TSval=664195 TSecr=664086"
"116","26.758727545","10.0.0.3","10.0.0.2","TCP","2962","43740  >  34568 [ACK] Seq=176393 Ack=1 Win=29696 Len=2896 TSval=664202 TSecr=664177"
"117","26.764340164","10.0.0.2","10.0.0.3","TCP","66","34568  >  43740 [ACK] Seq=1 Ack=134401 Win=238080 Len=0 TSval=664201 TSecr=664091"
"118","26.783188248","10.0.0.3","10.0.0.2","TCP","2962","43740  >  34568 [ACK] Seq=179289 Ack=1 Win=29696 Len=2896 TSval=664208 TSecr=664183"
"119","26.789208907","10.0.0.2","10.0.0.3","TCP","66","34568  >  43740 [ACK] Seq=1 Ack=137297 Win=238080 Len=0 TSval=664207 TSecr=664098"
"120","26.808221750","10.0.0.3","10.0.0.2","TCP","2962","43740  >  34568 [ACK] Seq=182185 Ack=1 Win=29696 Len=2896 TSval=664208 TSecr=664183"
"121","26.831780424","10.0.0.3","10.0.0.2","TCP","2962","43740  >  34568 [ACK] Seq=185081 Ack=1 Win=29696 Len=2896 TSval=664214 TSecr=664189"
"122","26.849225296","10.0.0.2","10.0.0.3","TCP","66","34568  >  43740 [ACK] Seq=1 Ack=141641 Win=238080 Len=0 TSval=664222 TSecr=664098"
"123","26.856191472","10.0.0.3","10.0.0.2","TCP","2962","43740  >  34568 [ACK] Seq=187977 Ack=1 Win=29696 Len=2896 TSval=664220 TSecr=664195"
"124","26.874316548","10.0.0.2","10.0.0.3","TCP","66","34568  >  43740 [ACK] Seq=1 Ack=144537 Win=238080 Len=0 TSval=664228 TSecr=664110"
"125","26.879552120","10.0.0.3","10.0.0.2","TCP","2962","43740  >  34568 [ACK] Seq=190873 Ack=1 Win=29696 Len=2896 TSval=664226 TSecr=664201"
"126","26.905072352","10.0.0.3","10.0.0.2","TCP","2962","43740  >  34568 [ACK] Seq=193769 Ack=1 Win=29696 Len=2896 TSval=664232 TSecr=664207"
"127","26.921755197","10.0.0.2","10.0.0.3","TCP","66","34568  >  43740 [ACK] Seq=1 Ack=147433 Win=238080 Len=0 TSval=664240 TSecr=664114"
"128","26.928121578","10.0.0.3","10.0.0.2","TCP","2962","43740  >  34568 [ACK] Seq=196665 Ack=1 Win=29696 Len=2896 TSval=664247 TSecr=664222"
"129","26.947052479","10.0.0.2","10.0.0.3","TCP","66","34568  >  43740 [ACK] Seq=1 Ack=150329 Win=238080 Len=0 TSval=664246 TSecr=664120"
"130","26.952228047","10.0.0.3","10.0.0.2","TCP","2962","43740  >  34568 [ACK] Seq=199561 Ack=1 Win=29696 Len=2896 TSval=664253 TSecr=664228"
"131","26.970579984","10.0.0.2","10.0.0.3","TCP","66","34568  >  43740 [ACK] Seq=1 Ack=153225 Win=238080 Len=0 TSval=664252 TSecr=664132"
"132","26.994743758","10.0.0.2","10.0.0.3","TCP","78","[TCP Dup ACK 131#1] 34568  >  43740 [ACK] Seq=1 Ack=153225 Win=238080 Len=0 TSval=664258 TSecr=664132 SLE=156121 SRE=159017"
"133","26.996167603","10.0.0.3","10.0.0.2","TCP","2962","43740  >  34568 [ACK] Seq=202457 Ack=1 Win=29696 Len=2896 TSval=664265 TSecr=664240"
"134","27.020798044","10.0.0.2","10.0.0.3","TCP","78","[TCP Dup ACK 131#2] 34568  >  43740 [ACK] Seq=1 Ack=153225 Win=238080 Len=0 TSval=664265 TSecr=664132 SLE=156121 SRE=161913"
"135","27.021387534","10.0.0.3","10.0.0.2","TCP","2962","43740  >  34568 [ACK] Seq=205353 Ack=1 Win=29696 Len=2896 TSval=664272 TSecr=664246"
"136","27.034250780","10.0.0.3","10.0.0.2","TCP","1514","43740  >  34568 [ACK] Seq=208249 Ack=1 Win=29696 Len=1448 TSval=664272 TSecr=664246"
"137","27.045019578","10.0.0.2","10.0.0.3","TCP","78","[TCP Dup ACK 131#3] 34568  >  43740 [ACK] Seq=1 Ack=153225 Win=238080 Len=0 TSval=664271 TSecr=664132 SLE=156121 SRE=164809"
"138","27.058297984","10.0.0.3","10.0.0.2","TCP","2962","43740  >  34568 [ACK] Seq=209697 Ack=1 Win=29696 Len=2896 TSval=664278 TSecr=664252"
"139","27.070134539","10.0.0.3","10.0.0.2","TCP","1514","[TCP Out-Of-Order] 43740  >  34568 [ACK] Seq=153225 Ack=1 Win=29696 Len=1448 TSval=664284 TSecr=664258"
"140","27.082465740","10.0.0.3","10.0.0.2","TCP","1514","43740  >  34568 [ACK] Seq=212593 Ack=1 Win=29696 Len=1448 TSval=664284 TSecr=664258"
"141","27.091997167","10.0.0.2","10.0.0.3","TCP","78","[TCP Dup ACK 131#4] 34568  >  43740 [ACK] Seq=1 Ack=153225 Win=238080 Len=0 TSval=664283 TSecr=664132 SLE=156121 SRE=167705"
"142","27.095491931","10.0.0.3","10.0.0.2","TCP","1514","[TCP Out-Of-Order] 43740  >  34568 [ACK] Seq=154673 Ack=1 Win=29696 Len=1448 TSval=664290 TSecr=664265"
"143","27.115463565","10.0.0.2","10.0.0.3","TCP","78","[TCP Dup ACK 131#5] 34568  >  43740 [ACK] Seq=1 Ack=153225 Win=238080 Len=0 TSval=664289 TSecr=664132 SLE=156121 SRE=170601"
"144","27.119572136","10.0.0.3","10.0.0.2","TCP","2962","43740  >  34568 [ACK] Seq=214041 Ack=1 Win=29696 Len=2896 TSval=664296 TSecr=664271"
"145","27.140231021","10.0.0.2","10.0.0.3","TCP","78","[TCP Dup ACK 131#6] 34568  >  43740 [ACK] Seq=1 Ack=153225 Win=238080 Len=0 TSval=664295 TSecr=664132 SLE=156121 SRE=173497"
"146","27.155031700","10.0.0.3","10.0.0.2","TCP","1514","43740  >  34568 [ACK] Seq=216937 Ack=1 Win=29696 Len=1448 TSval=664308 TSecr=664283"
"147","27.163879696","10.0.0.2","10.0.0.3","TCP","78","[TCP Dup ACK 131#7] 34568  >  43740 [ACK] Seq=1 Ack=153225 Win=238080 Len=0 TSval=664301 TSecr=664132 SLE=156121 SRE=176393"
"148","27.177930113","10.0.0.3","10.0.0.2","TCP","1514","43740  >  34568 [ACK] Seq=218385 Ack=1 Win=29696 Len=1448 TSval=664314 TSecr=664289"
"149","27.188372130","10.0.0.2","10.0.0.3","TCP","78","[TCP Dup ACK 131#8] 34568  >  43740 [ACK] Seq=1 Ack=153225 Win=238080 Len=0 TSval=664307 TSecr=664132 SLE=156121 SRE=179289"
"150","27.214586530","10.0.0.3","10.0.0.2","TCP","2962","43740  >  34568 [ACK] Seq=219833 Ack=1 Win=29696 Len=2896 TSval=664320 TSecr=664295"
"151","27.214581911","10.0.0.2","10.0.0.3","TCP","78","[TCP Dup ACK 131#9] 34568  >  43740 [ACK] Seq=1 Ack=153225 Win=238080 Len=0 TSval=664313 TSecr=664132 SLE=156121 SRE=182185"
"152","27.226968667","10.0.0.3","10.0.0.2","TCP","1514","43740  >  34568 [ACK] Seq=222729 Ack=1 Win=29696 Len=1448 TSval=664326 TSecr=664301"
"153","27.237663193","10.0.0.2","10.0.0.3","TCP","78","[TCP Dup ACK 131#10] 34568  >  43740 [ACK] Seq=1 Ack=153225 Win=238080 Len=0 TSval=664319 TSecr=664132 SLE=156121 SRE=185081"
"154","27.250889965","10.0.0.3","10.0.0.2","TCP","1514","43740  >  34568 [ACK] Seq=224177 Ack=1 Win=29696 Len=1448 TSval=664332 TSecr=664307"
"155","27.262007606","10.0.0.2","10.0.0.3","TCP","78","[TCP Dup ACK 131#11] 34568  >  43740 [ACK] Seq=1 Ack=153225 Win=238080 Len=0 TSval=664325 TSecr=664132 SLE=156121 SRE=187977"
"156","27.285222080","10.0.0.2","10.0.0.3","TCP","78","[TCP Dup ACK 131#12] 34568  >  43740 [ACK] Seq=1 Ack=153225 Win=238080 Len=0 TSval=664331 TSecr=664132 SLE=156121 SRE=190873"
"157","27.289318069","10.0.0.3","10.0.0.2","TCP","2962","43740  >  34568 [ACK] Seq=225625 Ack=1 Win=29696 Len=2896 TSval=664339 TSecr=664313"
"158","27.302434045","10.0.0.3","10.0.0.2","TCP","1514","43740  >  34568 [ACK] Seq=228521 Ack=1 Win=29696 Len=1448 TSval=664344 TSecr=664319"
"159","27.309731768","10.0.0.2","10.0.0.3","TCP","78","[TCP Dup ACK 131#13] 34568  >  43740 [ACK] Seq=1 Ack=153225 Win=238080 Len=0 TSval=664337 TSecr=664132 SLE=156121 SRE=193769"
"160","27.336520924","10.0.0.3","10.0.0.2","TCP","2962","43740  >  34568 [ACK] Seq=229969 Ack=1 Win=29696 Len=2896 TSval=664350 TSecr=664325"
"161","27.348776431","10.0.0.3","10.0.0.2","TCP","1514","43740  >  34568 [ACK] Seq=232865 Ack=1 Win=29696 Len=1448 TSval=664356 TSecr=664331"
"162","27.358674108","10.0.0.2","10.0.0.3","TCP","78","[TCP Dup ACK 131#14] 34568  >  43740 [ACK] Seq=1 Ack=153225 Win=238080 Len=0 TSval=664349 TSecr=664132 SLE=156121 SRE=196665"
"163","27.372340075","10.0.0.3","10.0.0.2","TCP","1514","43740  >  34568 [ACK] Seq=234313 Ack=1 Win=29696 Len=1448 TSval=664362 TSecr=664337"
"164","27.382853782","10.0.0.2","10.0.0.3","TCP","78","[TCP Dup ACK 131#15] 34568  >  43740 [ACK] Seq=1 Ack=153225 Win=238080 Len=0 TSval=664355 TSecr=664132 SLE=156121 SRE=199561"
"165","27.406487198","10.0.0.2","10.0.0.3","TCP","78","[TCP Dup ACK 131#16] 34568  >  43740 [ACK] Seq=1 Ack=153225 Win=238080 Len=0 TSval=664361 TSecr=664132 SLE=156121 SRE=202457"
"166","27.433794872","10.0.0.3","10.0.0.2","TCP","2962","43740  >  34568 [ACK] Seq=235761 Ack=1 Win=29696 Len=2896 TSval=664375 TSecr=664349"
"167","27.445756795","10.0.0.3","10.0.0.2","TCP","1514","43740  >  34568 [ACK] Seq=238657 Ack=1 Win=29696 Len=1448 TSval=664381 TSecr=664355"
"168","27.479733345","10.0.0.2","10.0.0.3","TCP","78","[TCP Dup ACK 131#17] 34568  >  43740 [ACK] Seq=1 Ack=153225 Win=238080 Len=0 TSval=664380 TSecr=664132 SLE=156121 SRE=205353"
"169","27.504239159","10.0.0.2","10.0.0.3","TCP","78","[TCP Dup ACK 131#18] 34568  >  43740 [ACK] Seq=1 Ack=153225 Win=238080 Len=0 TSval=664386 TSecr=664132 SLE=156121 SRE=208249"
"170","27.527951445","10.0.0.2","10.0.0.3","TCP","78","[TCP Dup ACK 131#19] 34568  >  43740 [ACK] Seq=1 Ack=153225 Win=238080 Len=0 TSval=664392 TSecr=664132 SLE=156121 SRE=209697"
"171","27.541415444","10.0.0.2","10.0.0.3","TCP","78","[TCP Dup ACK 131#20] 34568  >  43740 [ACK] Seq=1 Ack=153225 Win=238080 Len=0 TSval=664395 TSecr=664132 SLE=156121 SRE=212593"
"172","27.554238673","10.0.0.3","10.0.0.2","TCP","2962","43740  >  34568 [ACK] Seq=240105 Ack=1 Win=29696 Len=2896 TSval=664405 TSecr=664380"
"173","27.564712094","10.0.0.2","10.0.0.3","TCP","78","34568  >  43740 [ACK] Seq=1 Ack=154673 Win=237056 Len=0 TSval=664401 TSecr=664284 SLE=156121 SRE=212593"
"174","27.576908238","10.0.0.2","10.0.0.3","TCP","78","[TCP Dup ACK 173#1] 34568  >  43740 [ACK] Seq=1 Ack=154673 Win=237056 Len=0 TSval=664404 TSecr=664284 SLE=156121 SRE=214041"
"175","27.578939634","10.0.0.3","10.0.0.2","TCP","2962","43740  >  34568 [ACK] Seq=243001 Ack=1 Win=29696 Len=2896 TSval=664411 TSecr=664386"
"176","27.589115794","10.0.0.2","10.0.0.3","TCP","66","34568  >  43740 [ACK] Seq=1 Ack=214041 Win=209408 Len=0 TSval=664407 TSecr=664290"
"177","27.591609803","10.0.0.3","10.0.0.2","TCP","1514","43740  >  34568 [ACK] Seq=245897 Ack=1 Win=29696 Len=1448 TSval=664417 TSecr=664392"
"178","27.601294301","10.0.0.2","10.0.0.3","TCP","66","34568  >  43740 [ACK] Seq=1 Ack=216937 Win=238080 Len=0 TSval=664410 TSecr=664296"
"179","27.616102618","10.0.0.3","10.0.0.2","TCP","2962","43740  >  34568 [ACK] Seq=247345 Ack=1 Win=29696 Len=2896 TSval=664420 TSecr=664395"
"180","27.628942319","10.0.0.3","10.0.0.2","TCP","1514","43740  >  34568 [ACK] Seq=250241 Ack=1 Win=29696 Len=1448 TSval=664426 TSecr=664401"
"181","27.639693968","10.0.0.2","10.0.0.3","TCP","66","34568  >  43740 [ACK] Seq=1 Ack=219833 Win=238592 Len=0 TSval=664419 TSecr=664308"
"182","27.640136910","10.0.0.3","10.0.0.2","TCP","1514","43740  >  34568 [ACK] Seq=251689 Ack=1 Win=29696 Len=1448 TSval=664429 TSecr=664404"
"183","27.648217644","10.0.0.2","10.0.0.3","TCP","66","34568  >  43740 [ACK] Seq=1 Ack=222729 Win=238080 Len=0 TSval=664422 TSecr=664320"
"184","27.664367176","10.0.0.3","10.0.0.2","TCP","2962","43740  >  34568 [ACK] Seq=253137 Ack=1 Win=29696 Len=2896 TSval=664432 TSecr=664407"
"185","27.685424207","10.0.0.2","10.0.0.3","TCP","66","34568  >  43740 [ACK] Seq=1 Ack=225625 Win=238592 Len=0 TSval=664431 TSecr=664326"
"186","27.688908067","10.0.0.3","10.0.0.2","TCP","2962","43740  >  34568 [ACK] Seq=256033 Ack=1 Win=29696 Len=2896 TSval=664432 TSecr=664407"
"187","27.699254817","10.0.0.2","10.0.0.3","TCP","66","34568  >  43740 [ACK] Seq=1 Ack=228521 Win=238080 Len=0 TSval=664434 TSecr=664339"
"188","27.701726057","10.0.0.3","10.0.0.2","TCP","1514","43740  >  34568 [ACK] Seq=258929 Ack=1 Win=29696 Len=1448 TSval=664432 TSecr=664407"
"189","27.725481505","10.0.0.3","10.0.0.2","TCP","2962","43740  >  34568 [ACK] Seq=260377 Ack=1 Win=29696 Len=2896 TSval=664435 TSecr=664410"
"190","27.734026257","10.0.0.2","10.0.0.3","TCP","66","34568  >  43740 [ACK] Seq=1 Ack=232865 Win=238080 Len=0 TSval=664443 TSecr=664344"
"191","27.749623578","10.0.0.3","10.0.0.2","TCP","2962","43740  >  34568 [ACK] Seq=263273 Ack=1 Win=29696 Len=2896 TSval=664445 TSecr=664419"
"192","27.772912629","10.0.0.2","10.0.0.3","TCP","66","34568  >  43740 [ACK] Seq=1 Ack=235761 Win=238592 Len=0 TSval=664452 TSecr=664356"
"193","27.773402580","10.0.0.3","10.0.0.2","TCP","2962","43740  >  34568 [ACK] Seq=266169 Ack=1 Win=29696 Len=2896 TSval=664447 TSecr=664422"
"194","27.783697468","10.0.0.2","10.0.0.3","TCP","66","34568  >  43740 [ACK] Seq=1 Ack=238657 Win=238080 Len=0 TSval=664455 TSecr=664375"
"195","27.797802032","10.0.0.3","10.0.0.2","TCP","2962","43740  >  34568 [ACK] Seq=269065 Ack=1 Win=29696 Len=2896 TSval=664456 TSecr=664431"
"196","27.822297837","10.0.0.3","10.0.0.2","TCP","2962","43740  >  34568 [ACK] Seq=271961 Ack=1 Win=29696 Len=2896 TSval=664460 TSecr=664434"
"197","27.846885597","10.0.0.3","10.0.0.2","TCP","2962","43740  >  34568 [ACK] Seq=274857 Ack=1 Win=29696 Len=2896 TSval=664468 TSecr=664443"
"198","27.847994995","10.0.0.2","10.0.0.3","TCP","66","34568  >  43740 [ACK] Seq=1 Ack=240105 Win=239616 Len=0 TSval=664472 TSecr=664381"
"199","27.867086347","10.0.0.2","10.0.0.3","TCP","66","34568  >  43740 [ACK] Seq=1 Ack=243001 Win=238080 Len=0 TSval=664476 TSecr=664405"
"200","27.870408744","10.0.0.3","10.0.0.2","TCP","2962","43740  >  34568 [ACK] Seq=277753 Ack=1 Win=29696 Len=2896 TSval=664478 TSecr=664452"
"201","27.892192766","10.0.0.2","10.0.0.3","TCP","66","34568  >  43740 [ACK] Seq=1 Ack=245897 Win=238080 Len=0 TSval=664482 TSecr=664411"
"202","27.895234776","10.0.0.3","10.0.0.2","TCP","2962","43740  >  34568 [ACK] Seq=280649 Ack=1 Win=29696 Len=2896 TSval=664481 TSecr=664455"
"203","27.928319120","10.0.0.2","10.0.0.3","TCP","66","34568  >  43740 [ACK] Seq=1 Ack=250241 Win=238080 Len=0 TSval=664492 TSecr=664417"
"204","27.942258877","10.0.0.3","10.0.0.2","TCP","2962","[TCP Previous segment not captured] 43740  >  34568 [ACK] Seq=286441 Ack=1 Win=29696 Len=2896 TSval=664502 TSecr=664476"
"205","27.963607648","10.0.0.2","10.0.0.3","TCP","66","34568  >  43740 [ACK] Seq=1 Ack=253137 Win=238592 Len=0 TSval=664501 TSecr=664426"
"206","27.966823773","10.0.0.3","10.0.0.2","TCP","2962","43740  >  34568 [ACK] Seq=289337 Ack=1 Win=29696 Len=2896 TSval=664508 TSecr=664482"
"207","27.976135182","10.0.0.2","10.0.0.3","TCP","66","34568  >  43740 [ACK] Seq=1 Ack=256033 Win=238080 Len=0 TSval=664504 TSecr=664432"
"208","28.002096963","10.0.0.2","10.0.0.3","TCP","66","34568  >  43740 [ACK] Seq=1 Ack=258929 Win=238080 Len=0 TSval=664510 TSecr=664432"
"209","28.002660754","10.0.0.3","10.0.0.2","TCP","2962","43740  >  34568 [ACK] Seq=292233 Ack=1 Win=29696 Len=2896 TSval=664517 TSecr=664492"
"210","28.024460941","10.0.0.2","10.0.0.3","TCP","66","34568  >  43740 [ACK] Seq=1 Ack=260377 Win=242688 Len=0 TSval=664516 TSecr=664432"
"211","28.028016461","10.0.0.3","10.0.0.2","TCP","2962","43740  >  34568 [ACK] Seq=295129 Ack=1 Win=29696 Len=2896 TSval=664517 TSecr=664492"
"212","28.037275380","10.0.0.2","10.0.0.3","TCP","66","34568  >  43740 [ACK] Seq=1 Ack=263273 Win=248320 Len=0 TSval=664519 TSecr=664435"
"213","28.052200565","10.0.0.3","10.0.0.2","TCP","2962","43740  >  34568 [ACK] Seq=298025 Ack=1 Win=29696 Len=2896 TSval=664526 TSecr=664501"
"214","28.063054519","10.0.0.2","10.0.0.3","TCP","66","34568  >  43740 [ACK] Seq=1 Ack=266169 Win=254464 Len=0 TSval=664525 TSecr=664445"
"215","28.075826461","10.0.0.3","10.0.0.2","TCP","2962","43740  >  34568 [ACK] Seq=300921 Ack=1 Win=29696 Len=2896 TSval=664529 TSecr=664504"
"216","28.086078177","10.0.0.2","10.0.0.3","TCP","66","34568  >  43740 [ACK] Seq=1 Ack=269065 Win=260096 Len=0 TSval=664531 TSecr=664447"
"217","28.099703787","10.0.0.3","10.0.0.2","TCP","2962","43740  >  34568 [ACK] Seq=303817 Ack=1 Win=29696 Len=2896 TSval=664535 TSecr=664510"
"218","28.110740969","10.0.0.2","10.0.0.3","TCP","66","34568  >  43740 [ACK] Seq=1 Ack=271961 Win=265728 Len=0 TSval=664537 TSecr=664456"
"219","28.111806714","10.0.0.3","10.0.0.2","TCP","1514","43740  >  34568 [ACK] Seq=306713 Ack=1 Win=29696 Len=1448 TSval=664541 TSecr=664516"
"220","28.132648786","10.0.0.2","10.0.0.3","TCP","66","34568  >  43740 [ACK] Seq=1 Ack=274857 Win=271872 Len=0 TSval=664543 TSecr=664460"
"221","28.136471364","10.0.0.3","10.0.0.2","TCP","2962","43740  >  34568 [ACK] Seq=308161 Ack=1 Win=29696 Len=2896 TSval=664544 TSecr=664519"
"222","28.158399810","10.0.0.2","10.0.0.3","TCP","66","34568  >  43740 [ACK] Seq=1 Ack=277753 Win=277504 Len=0 TSval=664549 TSecr=664468"
"223","28.160491370","10.0.0.3","10.0.0.2","TCP","2962","[TCP Previous segment not captured] 43740  >  34568 [ACK] Seq=313953 Ack=1 Win=29696 Len=2896 TSval=664556 TSecr=664531"
"224","28.181975807","10.0.0.2","10.0.0.3","TCP","66","34568  >  43740 [ACK] Seq=1 Ack=280649 Win=283136 Len=0 TSval=664555 TSecr=664478"
"225","28.185294900","10.0.0.3","10.0.0.2","TCP","2962","43740  >  34568 [ACK] Seq=316849 Ack=1 Win=29696 Len=2896 TSval=664563 TSecr=664537"
"226","28.210666874","10.0.0.3","10.0.0.2","TCP","2962","43740  >  34568 [ACK] Seq=319745 Ack=1 Win=29696 Len=2896 TSval=664568 TSecr=664543"
"227","28.230552509","10.0.0.2","10.0.0.3","TCP","66","34568  >  43740 [ACK] Seq=1 Ack=283545 Win=289280 Len=0 TSval=664567 TSecr=664481"
"228","28.233761296","10.0.0.3","10.0.0.2","TCP","2962","43740  >  34568 [ACK] Seq=322641 Ack=1 Win=29696 Len=2896 TSval=664574 TSecr=664549"
"229","28.258236802","10.0.0.3","10.0.0.2","TCP","2962","43740  >  34568 [ACK] Seq=325537 Ack=1 Win=29696 Len=2896 TSval=664580 TSecr=664555"
"230","28.278938858","10.0.0.2","10.0.0.3","TCP","78","[TCP Window Update] 34568  >  43740 [ACK] Seq=1 Ack=283545 Win=294912 Len=0 TSval=664579 TSecr=664481 SLE=286441 SRE=289337"
"231","28.304680671","10.0.0.2","10.0.0.3","TCP","78","[TCP Window Update] 34568  >  43740 [ACK] Seq=1 Ack=283545 Win=300544 Len=0 TSval=664586 TSecr=664481 SLE=286441 SRE=292233"
"232","28.305132960","10.0.0.3","10.0.0.2","TCP","2962","43740  >  34568 [ACK] Seq=328433 Ack=1 Win=29696 Len=2896 TSval=664593 TSecr=664567"
"233","28.327474171","10.0.0.2","10.0.0.3","TCP","78","[TCP Window Update] 34568  >  43740 [ACK] Seq=1 Ack=283545 Win=306688 Len=0 TSval=664592 TSecr=664481 SLE=286441 SRE=295129"
"234","28.330441680","10.0.0.3","10.0.0.2","TCP","2962","43740  >  34568 [ACK] Seq=331329 Ack=1 Win=29696 Len=2896 TSval=664593 TSecr=664567"
"235","28.341840675","10.0.0.3","10.0.0.2","TCP","1514","[TCP Out-Of-Order] 43740  >  34568 [ACK] Seq=283545 Ack=1 Win=29696 Len=1448 TSval=664605 TSecr=664579"
"236","28.351999272","10.0.0.2","10.0.0.3","TCP","78","[TCP Window Update] 34568  >  43740 [ACK] Seq=1 Ack=283545 Win=312320 Len=0 TSval=664598 TSecr=664481 SLE=286441 SRE=298025"
"237","28.353623789","10.0.0.3","10.0.0.2","TCP","1514","43740  >  34568 [ACK] Seq=334225 Ack=1 Win=29696 Len=1448 TSval=664605 TSecr=664579"
"238","28.368270525","10.0.0.3","10.0.0.2","TCP","1514","[TCP Out-Of-Order] 43740  >  34568 [ACK] Seq=284993 Ack=1 Win=29696 Len=1448 TSval=664611 TSecr=664586"
"239","28.375381146","10.0.0.2","10.0.0.3","TCP","78","[TCP Window Update] 34568  >  43740 [ACK] Seq=1 Ack=283545 Win=317952 Len=0 TSval=664604 TSecr=664481 SLE=286441 SRE=300921"
"240","28.401727181","10.0.0.2","10.0.0.3","TCP","78","[TCP Window Update] 34568  >  43740 [ACK] Seq=1 Ack=283545 Win=323584 Len=0 TSval=664610 TSecr=664481 SLE=286441 SRE=303817"
"241","28.402193046","10.0.0.3","10.0.0.2","TCP","2962","43740  >  34568 [ACK] Seq=335673 Ack=1 Win=29696 Len=2896 TSval=664617 TSecr=664592"
"242","28.414465365","10.0.0.3","10.0.0.2","TCP","1514","43740  >  34568 [ACK] Seq=338569 Ack=1 Win=29696 Len=1448 TSval=664623 TSecr=664598"
"243","28.425003258","10.0.0.2","10.0.0.3","TCP","78","[TCP Window Update] 34568  >  43740 [ACK] Seq=1 Ack=283545 Win=329728 Len=0 TSval=664616 TSecr=664481 SLE=286441 SRE=306713"
"244","28.437890280","10.0.0.3","10.0.0.2","TCP","1514","43740  >  34568 [ACK] Seq=340017 Ack=1 Win=29696 Len=1448 TSval=664629 TSecr=664604"
"245","28.448366066","10.0.0.2","10.0.0.3","TCP","78","[TCP Window Update] 34568  >  43740 [ACK] Seq=1 Ack=283545 Win=332288 Len=0 TSval=664622 TSecr=664481 SLE=286441 SRE=308161"
"246","28.460338499","10.0.0.2","10.0.0.3","TCP","78","[TCP Window Update] 34568  >  43740 [ACK] Seq=1 Ack=283545 Win=338432 Len=0 TSval=664625 TSecr=664481 SLE=286441 SRE=311057"
"247","28.476608353","10.0.0.3","10.0.0.2","TCP","2962","43740  >  34568 [ACK] Seq=341465 Ack=1 Win=29696 Len=2896 TSval=664635 TSecr=664610"
"248","28.484806597","10.0.0.2","10.0.0.3","TCP","86","[TCP Window Update] 34568  >  43740 [ACK] Seq=1 Ack=283545 Win=344064 Len=0 TSval=664631 TSecr=664481 SLE=313953 SRE=316849 SLE=286441 SRE=311057"
"249","28.494379958","10.0.0.3","10.0.0.2","TCP","1514","43740  >  34568 [ACK] Seq=344361 Ack=1 Win=29696 Len=1448 TSval=664641 TSecr=664616"
"250","28.509914880","10.0.0.2","10.0.0.3","TCP","86","[TCP Window Update] 34568  >  43740 [ACK] Seq=1 Ack=283545 Win=349696 Len=0 TSval=664637 TSecr=664481 SLE=313953 SRE=319745 SLE=286441 SRE=311057"
"251","28.510803919","10.0.0.3","10.0.0.2","TCP","1514","43740  >  34568 [ACK] Seq=345809 Ack=1 Win=29696 Len=1448 TSval=664647 TSecr=664622"
"252","28.522760187","10.0.0.3","10.0.0.2","TCP","1514","43740  >  34568 [ACK] Seq=347257 Ack=1 Win=29696 Len=1448 TSval=664650 TSecr=664625"
"253","28.534517278","10.0.0.2","10.0.0.3","TCP","86","[TCP Window Update] 34568  >  43740 [ACK] Seq=1 Ack=283545 Win=355840 Len=0 TSval=664643 TSecr=664481 SLE=313953 SRE=322641 SLE=286441 SRE=311057"
"254","28.557249862","10.0.0.2","10.0.0.3","TCP","86","[TCP Window Update] 34568  >  43740 [ACK] Seq=1 Ack=283545 Win=361472 Len=0 TSval=664649 TSecr=664481 SLE=313953 SRE=325537 SLE=286441 SRE=311057"
"255","28.573320488","10.0.0.3","10.0.0.2","TCP","1514","[TCP Out-Of-Order] 43740  >  34568 [ACK] Seq=311057 Ack=1 Win=29696 Len=1448 TSval=664663 TSecr=664637"
"256","28.583938734","10.0.0.2","10.0.0.3","TCP","86","[TCP Window Update] 34568  >  43740 [ACK] Seq=1 Ack=283545 Win=367104 Len=0 TSval=664655 TSecr=664481 SLE=313953 SRE=328433 SLE=286441 SRE=311057"
"257","28.585646849","10.0.0.3","10.0.0.2","TCP","1514","[TCP Out-Of-Order] 43740  >  34568 [ACK] Seq=312505 Ack=1 Win=29696 Len=1448 TSval=664663 TSecr=664637"
"258","28.609537084","10.0.0.3","10.0.0.2","TCP","2962","43740  >  34568 [ACK] Seq=348705 Ack=1 Win=29696 Len=2896 TSval=664669 TSecr=664643"
"259","28.633877243","10.0.0.3","10.0.0.2","TCP","2962","43740  >  34568 [ACK] Seq=351601 Ack=1 Win=29696 Len=2896 TSval=664674 TSecr=664649"
"260","28.644803189","10.0.0.2","10.0.0.3","TCP","86","[TCP Window Update] 34568  >  43740 [ACK] Seq=1 Ack=283545 Win=373248 Len=0 TSval=664671 TSecr=664481 SLE=313953 SRE=331329 SLE=286441 SRE=311057"
"261","28.658677963","10.0.0.3","10.0.0.2","TCP","2962","43740  >  34568 [ACK] Seq=354497 Ack=1 Win=29696 Len=2896 TSval=664681 TSecr=664655"
"262","28.680406113","10.0.0.2","10.0.0.3","TCP","86","[TCP Window Update] 34568  >  43740 [ACK] Seq=1 Ack=283545 Win=378880 Len=0 TSval=664680 TSecr=664481 SLE=313953 SRE=334225 SLE=286441 SRE=311057"
"263","28.706398065","10.0.0.2","10.0.0.3","TCP","86","34568  >  43740 [ACK] Seq=1 Ack=284993 Win=381952 Len=0 TSval=664686 TSecr=664605 SLE=313953 SRE=334225 SLE=286441 SRE=311057"
"264","28.723439291","10.0.0.3","10.0.0.2","TCP","2962","43740  >  34568 [ACK] Seq=357393 Ack=1 Win=29696 Len=2896 TSval=664696 TSecr=664671"
"265","28.745685712","10.0.0.2","10.0.0.3","TCP","86","[TCP Window Update] 34568  >  43740 [ACK] Seq=1 Ack=284993 Win=384512 Len=0 TSval=664694 TSecr=664605 SLE=313953 SRE=335673 SLE=286441 SRE=311057"
"266","28.756697441","10.0.0.3","10.0.0.2","TCP","2962","43740  >  34568 [ACK] Seq=360289 Ack=1 Win=29696 Len=2896 TSval=664705 TSecr=664680"
"267","28.757181992","10.0.0.2","10.0.0.3","TCP","78","34568  >  43740 [ACK] Seq=1 Ack=311057 Win=387584 Len=0 TSval=664698 TSecr=664611 SLE=313953 SRE=335673"
"268","28.764532824","10.0.0.2","10.0.0.3","TCP","78","[TCP Window Update] 34568  >  43740 [ACK] Seq=1 Ack=311057 Win=393216 Len=0 TSval=664701 TSecr=664611 SLE=313953 SRE=338569"
"269","28.769551680","10.0.0.3","10.0.0.2","TCP","1514","43740  >  34568 [ACK] Seq=363185 Ack=1 Win=29696 Len=1448 TSval=664712 TSecr=664686"
"270","28.796269046","10.0.0.2","10.0.0.3","TCP","78","[TCP Window Update] 34568  >  43740 [ACK] Seq=1 Ack=311057 Win=396288 Len=0 TSval=664709 TSecr=664611 SLE=313953 SRE=340017"
